director_name,actor_1_name,actor_2_name,actor_3_name,genres,movie_title,comb
Fred Zinnemann,Robert Shaw,Susannah York,Paul Scofield,Biography Drama History,a man for all seasons,Fred Zinnemann Robert Shaw Susannah York Paul Scofield Biography Drama History
Sidney Lumet,Robert Duvall,Faye Dunaway,William Holden,Drama Romance,network,Sidney Lumet Robert Duvall Faye Dunaway William Holden Drama Romance
Victor Fleming,Hattie McDaniel,George Reeves,Thomas Mitchell,Drama History Romance War,gone with the wind,Victor Fleming Hattie McDaniel George Reeves Thomas Mitchell Drama History Romance War
Richard Raymond,Tom Cullen,Reece Ritchie,Marama Corlett,Biography Drama,desert dancer,Richard Raymond Tom Cullen Reece Ritchie Marama Corlett Biography Drama
Sam Peckinpah,James Coburn,Slim Pickens,Warren Oates,Adventure War Western,major dundee,Sam Peckinpah James Coburn Slim Pickens Warren Oates Adventure War Western
Alan Jacobs,Snoop Dogg,Laz Alonso,Nicholas Gonzalez,Drama,down for life,Alan Jacobs Snoop Dogg Laz Alonso Nicholas Gonzalez Drama
George Sidney,Keenan Wynn,Howard Keel,Betty Hutton,Biography Comedy Musical Romance Western,annie get your gun,George Sidney Keenan Wynn Howard Keel Betty Hutton Biography Comedy Musical Romance Western
Christopher Morris,Kayvan Novak,Riz Ahmed,Alex Macqueen,Comedy Crime Drama,four lions,Christopher Morris Kayvan Novak Riz Ahmed Alex Macqueen Comedy Crime Drama
Andrucha Waddington,Fernanda Montenegro,Seu Jorge,Fernanda Torres,Drama,house of sand,Andrucha Waddington Fernanda Montenegro Seu Jorge Fernanda Torres Drama
Peter Stebbings,Michael Kelly,Tony Nappo,Charlotte Sullivan,Comedy Crime Drama,defendor,Peter Stebbings Michael Kelly Tony Nappo Charlotte Sullivan Comedy Crime Drama
Vincente Minnelli,Gladys Cooper,Reginald Owen,Ellen Ross,Adventure Comedy Musical Romance,the pirate,Vincente Minnelli Gladys Cooper Reginald Owen Ellen Ross Adventure Comedy Musical Romance
Dagur Kári,Alice Olivia Clarke,Susan Blommaert,Stephen Henderson,Drama,the good heart,Dagur Kári Alice Olivia Clarke Susan Blommaert Stephen Henderson Drama
Nicholas Hytner,Dominic Cooper,Russell Tovey,James Corden,Comedy Drama,the history boys,Nicholas Hytner Dominic Cooper Russell Tovey James Corden Comedy Drama
Jaume Collet-Serra,Liam Neeson,Frank Langella,Aidan Quinn,Action Mystery Thriller,unknown,Jaume Collet-Serra Liam Neeson Frank Langella Aidan Quinn Action Mystery Thriller
Unknown,David Ogden Stiers,Jamie Farr,Mike Farrell,Comedy Drama War,m*a*s*h            ,Unknown David Ogden Stiers Jamie Farr Mike Farrell Comedy Drama War
John Schlesinger,Brenda Vaccaro,Barnard Hughes,John McGiver,Drama,midnight cowboy,John Schlesinger Brenda Vaccaro Barnard Hughes John McGiver Drama
Jim Abrahams,Peter Graves,Lloyd Bridges,Barbara Billingsley,Comedy,airplane!,Jim Abrahams Peter Graves Lloyd Bridges Barbara Billingsley Comedy
Kevin Carraway,Michael Jai White,Max Ryan,Jon Osbeck,Action Thriller,chain of command,Kevin Carraway Michael Jai White Max Ryan Jon Osbeck Action Thriller
F. Gary Gray,Nia Long,John Witherspoon,Tony Cox,Comedy Drama,friday,F. Gary Gray Nia Long John Witherspoon Tony Cox Comedy Drama
Albert Hughes,Jada Pinkett Smith,Larenz Tate,Khandi Alexander,Crime Drama Thriller,menace ii society,Albert Hughes Jada Pinkett Smith Larenz Tate Khandi Alexander Crime Drama Thriller
Unknown,Ta'Rhonda Jones,Gabourey Sidibe,Malik Yoba,Drama Music,empire            ,Unknown Ta'Rhonda Jones Gabourey Sidibe Malik Yoba Drama Music
Michael Gornick,George Kennedy,Holt McCallany,Dorothy Lamour,Comedy Fantasy Horror Thriller,creepshow 2,Michael Gornick George Kennedy Holt McCallany Dorothy Lamour Comedy Fantasy Horror Thriller
Sam Peckinpah,Slim Pickens,Jason Robards,L.Q. Jones,Comedy Drama Romance Western,the ballad of cable hogue,Sam Peckinpah Slim Pickens Jason Robards L.Q. Jones Comedy Drama Romance Western
Richard Brooks,John Forsythe,Robert Blake,Will Geer,Biography Crime Drama History,in cold blood,Richard Brooks John Forsythe Robert Blake Will Geer Biography Crime Drama History
Fred Zinnemann,Colleen Dewhurst,Peter Finch,Beatrice Straight,Drama,the nun's story,Fred Zinnemann Colleen Dewhurst Peter Finch Beatrice Straight Drama
Jack Smight,Janet Leigh,Robert Wagner,Shelley Winters,Action Crime Drama Mystery Thriller,harper,Jack Smight Janet Leigh Robert Wagner Shelley Winters Action Crime Drama Mystery Thriller
Alfred Hitchcock,Bernard Cribbins,Jean Marsh,Clive Swift,Thriller,frenzy,Alfred Hitchcock Bernard Cribbins Jean Marsh Clive Swift Thriller
Robert Eggers,Julian Richings,Kate Dickie,Ralph Ineson,Horror Mystery,the witch,Robert Eggers Julian Richings Kate Dickie Ralph Ineson Horror Mystery
Michael Martin,Joe Estevez,Master P,Anthony Johnson,Comedy,i got the hook up,Michael Martin Joe Estevez Master P Anthony Johnson Comedy
Edward Burns,John Mahoney,Frank Vincent,Michael McGlone,Comedy Drama Romance,she's the one,Edward Burns John Mahoney Frank Vincent Michael McGlone Comedy Drama Romance
Bill Condon,Brendan Fraser,Lynn Redgrave,Kevin J. O'Connor,Biography Drama,gods and monsters,Bill Condon Brendan Fraser Lynn Redgrave Kevin J. O'Connor Biography Drama
Juan José Campanella,Ricardo Darín,Soledad Villamil,Guillermo Francella,Drama Mystery Thriller,the secret in their eyes,Juan José Campanella Ricardo Darín Soledad Villamil Guillermo Francella Drama Mystery Thriller
George A. Romero,Greg Nicotero,John Amplas,Joseph Pilato,Horror,day of the dead,George A. Romero Greg Nicotero John Amplas Joseph Pilato Horror
Gideon Raff,Gideon Emery,Gloria Votsis,Derek Magyar,Horror Thriller,train,Gideon Raff Gideon Emery Gloria Votsis Derek Magyar Horror Thriller
Sam Raimi,Ted Raimi,Dan Hicks,Kassie Wesley DePaiva,Comedy Fantasy Horror Thriller,evil dead ii,Sam Raimi Ted Raimi Dan Hicks Kassie Wesley DePaiva Comedy Fantasy Horror Thriller
Louis C.K.,Wanda Sykes,J.B. Smoove,Robert Vaughn,Action Adventure Comedy Musical,pootie tang,Louis C.K. Wanda Sykes J.B. Smoove Robert Vaughn Action Adventure Comedy Musical
Anthony C. Ferrante,Ian Ziering,John Heard,Cassandra Scerbo,Horror,sharknado,Anthony C. Ferrante Ian Ziering John Heard Cassandra Scerbo Horror
Salvador Carrasco,Elpidia Carrillo,Zaide Silvia Gutiérrez,Damián Delgado,Drama History,la otra conquista,Salvador Carrasco Elpidia Carrillo Zaide Silvia Gutiérrez Damián Delgado Drama History
André Øvredal,Otto Jespersen,Johanna Mørck,Glenn Erland Tosterud,Comedy Drama Fantasy Horror,trollhunter,André Øvredal Otto Jespersen Johanna Mørck Glenn Erland Tosterud Comedy Drama Fantasy Horror
Robert Cary,Frances Conroy,Fred Willard,Kevin Sussman,Comedy Romance,ira & abby,Robert Cary Frances Conroy Fred Willard Kevin Sussman Comedy Romance
Akiva Schaffer,Will Forte,Nicholas Braun,Rosemarie DeWitt,Action Comedy Sci-Fi,the watch,Akiva Schaffer Will Forte Nicholas Braun Rosemarie DeWitt Action Comedy Sci-Fi
Adam Rapp,Zooey Deschanel,Will Ferrell,Dallas Roberts,Comedy Drama,winter passing,Adam Rapp Zooey Deschanel Will Ferrell Dallas Roberts Comedy Drama
Angela Robinson,Jordana Brewster,Geoff Stults,Scoot McNairy,Action Comedy Romance,d.e.b.s.,Angela Robinson Jordana Brewster Geoff Stults Scoot McNairy Action Comedy Romance
Warren P. Sonoda,Diahann Carroll,Mykel Shannon Jenkins,Lara Jean Chorostecki,Action Biography Crime Drama Family Fantasy,the masked saint,Warren P. Sonoda Diahann Carroll Mykel Shannon Jenkins Lara Jean Chorostecki Action Biography Crime Drama Family Fantasy
Amanda Gusack,Alice Krige,Christian Campbell,Blaine Anderson,Crime Drama Mystery Thriller,the betrayed,Amanda Gusack Alice Krige Christian Campbell Blaine Anderson Crime Drama Mystery Thriller
Avi Nesher,Fisher Stevens,Elizabeth Berkley,Robert Townsend,Action Comedy Crime Thriller,taxman,Avi Nesher Fisher Stevens Elizabeth Berkley Robert Townsend Action Comedy Crime Thriller
Unknown,James Nesbitt,Ash Cook,Genevieve O'Reilly,Drama Thriller,the secret            ,Unknown James Nesbitt Ash Cook Genevieve O'Reilly Drama Thriller
Charles Adelman,Teri Polo,Kevin Pollak,Jere Burns,Horror Thriller,2:13,Charles Adelman Teri Polo Kevin Pollak Jere Burns Horror Thriller
Jay Oliva,Michael Emerson,Mark Valley,Grey Griffin,Action Animation Crime Sci-Fi Thriller,"batman: the dark knight returns, part 2",Jay Oliva Michael Emerson Mark Valley Grey Griffin Action Animation Crime Sci-Fi Thriller
Charles Ferguson,Jane Goodall,Jerry Brown,Peter Agnefjall,Documentary,time to choose,Charles Ferguson Jane Goodall Jerry Brown Peter Agnefjall Documentary
Uwe Boll,Bashar Rahal,Shelly Varod,Ralitsa Paskaleva,Action Adventure Fantasy Thriller,in the name of the king: the last job,Uwe Boll Bashar Rahal Shelly Varod Ralitsa Paskaleva Action Adventure Fantasy Thriller
Mark Young,Alexa PenaVega,Jake Busey,Lew Temple,Action Crime Drama Thriller,wicked blood,Mark Young Alexa PenaVega Jake Busey Lew Temple Action Crime Drama Thriller
Daniel Petrie Jr.,Chris Brochu,Jeff Fahey,Rita Wilson,Drama Thriller,dawn patrol,Daniel Petrie Jr. Chris Brochu Jeff Fahey Rita Wilson Drama Thriller
Antonio Simoncini,Ray Winstone,Joe Egan,Glen Murphy,Crime Mystery Thriller,lords of london,Antonio Simoncini Ray Winstone Joe Egan Glen Murphy Crime Mystery Thriller
Mel Brooks,Madeline Kahn,Harvey Korman,Dick Van Patten,Comedy,high anxiety,Mel Brooks Madeline Kahn Harvey Korman Dick Van Patten Comedy
Luc Jacquet,Morgan Freeman,Sofie Gråbøl,Romane Bohringer,Documentary,march of the penguins,Luc Jacquet Morgan Freeman Sofie Gråbøl Romane Bohringer Documentary
J.C. Chandor,Kevin Spacey,Demi Moore,Ashley Williams,Biography Drama Thriller,margin call,J.C. Chandor Kevin Spacey Demi Moore Ashley Williams Biography Drama Thriller
Eldar Rapaport,Murray Bartlett,Adrian Gonzalez,Edward Conna,Drama Romance,august,Eldar Rapaport Murray Bartlett Adrian Gonzalez Edward Conna Drama Romance
Clark Gregg,Anjelica Huston,Matt Gerald,Jonah Bobo,Comedy Drama,choke,Clark Gregg Anjelica Huston Matt Gerald Jonah Bobo Comedy Drama
Damien Chazelle,J.K. Simmons,Melissa Benoist,Chris Mulkey,Drama Music,whiplash,Damien Chazelle J.K. Simmons Melissa Benoist Chris Mulkey Drama Music
Fernando Meirelles,Alice Braga,Seu Jorge,Alexandre Rodrigues,Crime Drama,city of god,Fernando Meirelles Alice Braga Seu Jorge Alexandre Rodrigues Crime Drama
Justin Kerrigan,Danny Dyer,John Simm,Shaun Parkes,Comedy Music,human traffic,Justin Kerrigan Danny Dyer John Simm Shaun Parkes Comedy Music
Nathan Frankowski,Corbin Bleu,Rus Blackwell,Luis Antonio,Biography Drama Music,day one,Nathan Frankowski Corbin Bleu Rus Blackwell Luis Antonio Biography Drama Music
Karen Moncrieff,James Franco,Bruce Davison,Piper Laurie,Crime Drama Mystery,the dead girl,Karen Moncrieff James Franco Bruce Davison Piper Laurie Crime Drama Mystery
Thomas Vinterberg,Thomas Bo Larsen,Alexandra Rapaport,Hana Shuan,Drama,the hunt,Thomas Vinterberg Thomas Bo Larsen Alexandra Rapaport Hana Shuan Drama
Bob Clark,Zack Ward,Darren McGavin,Scott Schwartz,Comedy Family,a christmas story,Bob Clark Zack Ward Darren McGavin Scott Schwartz Comedy Family
Alejandro Monteverde,Armando Riesco,Ramon Rodriguez,Eduardo Verástegui,Drama Romance,bella,Alejandro Monteverde Armando Riesco Ramon Rodriguez Eduardo Verástegui Drama Romance
Mark L. Lester,Roddy McDowall,Perry King,Timothy Van Patten,Action Crime Drama Thriller,class of 1984,Mark L. Lester Roddy McDowall Perry King Timothy Van Patten Action Crime Drama Thriller
Jennifer Finnigan,Geoff Stults,Kenan Thompson,Josh Hopkins,Comedy,the opposite sex,Jennifer Finnigan Geoff Stults Kenan Thompson Josh Hopkins Comedy
Eric Styles,Samantha Morton,Rupert Graves,Miriam Margolyes,Drama Romance,dreaming of joseph lees,Eric Styles Samantha Morton Rupert Graves Miriam Margolyes Drama Romance
Laurent Cantet,François Bégaudeau,Agame Malembo-Emene,Angélica Sancio,Drama,the class,Laurent Cantet François Bégaudeau Agame Malembo-Emene Angélica Sancio Drama
Roman Polanski,John Cassavetes,Mia Farrow,Charles Grodin,Drama Horror,rosemary's baby,Roman Polanski John Cassavetes Mia Farrow Charles Grodin Drama Horror
John Ford,Lee Marvin,Woody Strode,Vera Miles,Drama Western,the man who shot liberty valance,John Ford Lee Marvin Woody Strode Vera Miles Drama Western
Max Mayer,Peter Gallagher,Terry Walters,Amy Irving,Drama Romance,adam,Max Mayer Peter Gallagher Terry Walters Amy Irving Drama Romance
Joshua Marston,Catalina Sandino Moreno,Wilson Guerrero,Yenny Paola Vega,Crime Drama,maria full of grace,Joshua Marston Catalina Sandino Moreno Wilson Guerrero Yenny Paola Vega Crime Drama
Mike Mills,Goran Visnjic,Lou Taylor Pucci,Mary Page Keller,Comedy Drama Romance,beginners,Mike Mills Goran Visnjic Lou Taylor Pucci Mary Page Keller Comedy Drama Romance
John Gulager,Krista Allen,Eric Dane,Henry Rollins,Action Comedy Horror Thriller,feast,John Gulager Krista Allen Eric Dane Henry Rollins Action Comedy Horror Thriller
John Landis,John Belushi,Karen Allen,Tim Matheson,Comedy,animal house,John Landis John Belushi Karen Allen Tim Matheson Comedy
Guy Hamilton,Honor Blackman,Gert Fröbe,Lois Maxwell,Action Adventure Thriller,goldfinger,Guy Hamilton Honor Blackman Gert Fröbe Lois Maxwell Action Adventure Thriller
Brandon Cronenberg,Sarah Gadon,Douglas Smith,Caleb Landry Jones,Horror Sci-Fi Thriller,antiviral,Brandon Cronenberg Sarah Gadon Douglas Smith Caleb Landry Jones Horror Sci-Fi Thriller
Frank Capra,Donna Reed,Lionel Barrymore,Thomas Mitchell,Drama Family Fantasy Romance,it's a wonderful life,Frank Capra Donna Reed Lionel Barrymore Thomas Mitchell Drama Family Fantasy Romance
Danny Boyle,Kelly Macdonald,Shirley Henderson,Ewen Bremner,Drama,trainspotting,Danny Boyle Kelly Macdonald Shirley Henderson Ewen Bremner Drama
Spike Lee,Bernie Mac,Cedric the Entertainer,Steve Harvey,Comedy Documentary,the original kings of comedy,Spike Lee Bernie Mac Cedric the Entertainer Steve Harvey Comedy Documentary
Tod Williams,Sprague Grayden,Molly Ephraim,Micah Sloat,Horror,paranormal activity 2,Tod Williams Sprague Grayden Molly Ephraim Micah Sloat Horror
Kirk Jones,James Nesbitt,David Kelly,Fionnula Flanagan,Comedy,waking ned devine,Kirk Jones James Nesbitt David Kelly Fionnula Flanagan Comedy
Michael Moore,Michael Moore,Dick Clark,Bill Clinton,Crime Documentary Drama,bowling for columbine,Michael Moore Michael Moore Dick Clark Bill Clinton Crime Documentary Drama
Yimou Zhang,Li Gong,Daoming Chen,Ni Yan,Drama,coming home,Yimou Zhang Li Gong Daoming Chen Ni Yan Drama
Jack Sholder,Clu Gulager,Robert Rusler,Marshall Bell,Fantasy Horror,a nightmare on elm street 2: freddy's revenge,Jack Sholder Clu Gulager Robert Rusler Marshall Bell Fantasy Horror
James Ivory,Julian Sands,Rupert Graves,Denholm Elliott,Drama Romance,a room with a view,James Ivory Julian Sands Rupert Graves Denholm Elliott Drama Romance
James DeMonaco,Rhys Wakefield,Adelaide Kane,Chris Mulkey,Horror Sci-Fi Thriller,the purge,James DeMonaco Rhys Wakefield Adelaide Kane Chris Mulkey Horror Sci-Fi Thriller
Scott Derrickson,Danielle Kotch,Victoria Leigh,James Ransone,Horror Mystery,sinister,Scott Derrickson Danielle Kotch Victoria Leigh James Ransone Horror Mystery
David Raynr,Nancy O'Dell,Mikki Padilla,Dayna Devon,Biography Comedy Documentary,martin lawrence live: runteldat,David Raynr Nancy O'Dell Mikki Padilla Dayna Devon Biography Comedy Documentary
Richard Brooks,Burl Ives,Judith Anderson,Jack Carson,Drama Romance,cat on a hot tin roof,Richard Brooks Burl Ives Judith Anderson Jack Carson Drama Romance
Ted Post,Linda Harrison,Gregory Sierra,Victor Buono,Action Adventure Sci-Fi,beneath the planet of the apes,Ted Post Linda Harrison Gregory Sierra Victor Buono Action Adventure Sci-Fi
Charles Martin Smith,Kevin Zegers,Bill Cobbs,Michael Jeter,Comedy Drama Family Sport,air bud,Charles Martin Smith Kevin Zegers Bill Cobbs Michael Jeter Comedy Drama Family Sport
Kunihiko Yuyama,Veronica Taylor,Eric Stuart,Lisa Ortiz,Action Adventure Animation Family Fantasy Sci-Fi,pokémon 3: the movie,Kunihiko Yuyama Veronica Taylor Eric Stuart Lisa Ortiz Action Adventure Animation Family Fantasy Sci-Fi
Tom McLoughlin,Tony Goldwyn,Ron Palillo,Vincent Guastaferro,Horror Thriller,jason lives: friday the 13th part vi,Tom McLoughlin Tony Goldwyn Ron Palillo Vincent Guastaferro Horror Thriller
David Lean,William Holden,Sessue Hayakawa,Jack Hawkins,Adventure Drama War,the bridge on the river kwai,David Lean William Holden Sessue Hayakawa Jack Hawkins Adventure Drama War
Patrick Read Johnson,Ariana Richards,Royal Dano,Tonya Lee Williams,Adventure Comedy Sci-Fi,spaced invaders,Patrick Read Johnson Ariana Richards Royal Dano Tonya Lee Williams Adventure Comedy Sci-Fi
Alfred Hitchcock,Ed Lauter,Bruce Dern,William Devane,Comedy Thriller,family plot,Alfred Hitchcock Ed Lauter Bruce Dern William Devane Comedy Thriller
Billy Wilder,Fred MacMurray,Ray Walston,David White,Comedy Drama Romance,the apartment,Billy Wilder Fred MacMurray Ray Walston David White Comedy Drama Romance
Adam Marcus,Kane Hodder,Leslie Jordan,Erin Gray,Fantasy Horror Thriller,jason goes to hell: the final friday,Adam Marcus Kane Hodder Leslie Jordan Erin Gray Fantasy Horror Thriller
Alfred Hitchcock,Tamara Toumanova,Lila Kedrova,David Opatoshu,Thriller,torn curtain,Alfred Hitchcock Tamara Toumanova Lila Kedrova David Opatoshu Thriller
Michel Gondry,Common,Dave Chappelle,Lauryn Hill,Comedy Documentary Music,dave chappelle's block party,Michel Gondry Common Dave Chappelle Lauryn Hill Comedy Documentary Music
John Maclean,Michael Fassbender,Kodi Smit-McPhee,Ben Mendelsohn,Western,slow west,John Maclean Michael Fassbender Kodi Smit-McPhee Ben Mendelsohn Western
Michael Schultz,Blair Underwood,LisaGay Hamilton,Bobby Brown,Comedy Drama Music,krush groove,Michael Schultz Blair Underwood LisaGay Hamilton Bobby Brown Comedy Drama Music
Benny Boom,Omari Hardwick,Donald Faison,Mike Epps,Action Comedy Crime,next day air,Benny Boom Omari Hardwick Donald Faison Mike Epps Action Comedy Crime
Richard Brooks,Shirley Jones,Jean Simmons,Edward Andrews,Drama,elmer gantry,Richard Brooks Shirley Jones Jean Simmons Edward Andrews Drama
Stanley Kramer,Maximilian Schell,Montgomery Clift,Spencer Tracy,Drama War,judgment at nuremberg,Stanley Kramer Maximilian Schell Montgomery Clift Spencer Tracy Drama War
David Raynr,Donald Faison,Deon Richmond,Countess Vaughn,Comedy,trippin',David Raynr Donald Faison Deon Richmond Countess Vaughn Comedy
Unknown,Matthew Senreich,Seth Green,Breckin Meyer,Animation Comedy,robot chicken            ,Unknown Matthew Senreich Seth Green Breckin Meyer Animation Comedy
Howard Hawks,Montgomery Clift,Walter Brennan,Harry Carey Jr.,Action Adventure Romance Western,red river,Howard Hawks Montgomery Clift Walter Brennan Harry Carey Jr. Action Adventure Romance Western
Nnegest Likké,Mo'Nique,Jimmy Jean-Louis,Joyful Drake,Comedy,phat girlz,Nnegest Likké Mo'Nique Jimmy Jean-Louis Joyful Drake Comedy
Richard Linklater,Seamus Davey-Fitzpatrick,Ariane Labed,Athina Rachel Tsangari,Drama Romance,before midnight,Richard Linklater Seamus Davey-Fitzpatrick Ariane Labed Athina Rachel Tsangari Drama Romance
Christopher Leitch,John Astin,Robert Neary,Kim Darby,Comedy Fantasy,teen wolf too,Christopher Leitch John Astin Robert Neary Kim Darby Comedy Fantasy
Don Coscarelli,Angus Scrimm,A. Michael Baldwin,James Le Gros,Action Fantasy Horror Sci-Fi Thriller,phantasm ii,Don Coscarelli Angus Scrimm A. Michael Baldwin James Le Gros Action Fantasy Horror Sci-Fi Thriller
Michael Schultz,Loretta Devine,Kimberly Elise,Clifton Powell,Drama,woman thou art loosed,Michael Schultz Loretta Devine Kimberly Elise Clifton Powell Drama
Patricia Cardoso,America Ferrera,Lupe Ontiveros,George Lopez,Comedy Drama,real women have curves,Patricia Cardoso America Ferrera Lupe Ontiveros George Lopez Comedy Drama
Unknown,Rachel Griffiths,Jessica De Gouw,Luke Ford,Drama War,deadline gallipoli            ,Unknown Rachel Griffiths Jessica De Gouw Luke Ford Drama War
Deepa Mehta,John Abraham,Lisa Ray,Seema Biswas,Drama Romance,water,Deepa Mehta John Abraham Lisa Ray Seema Biswas Drama Romance
Damien O'Donnell,Archie Panjabi,Jimi Mistry,Om Puri,Comedy Drama,east is east,Damien O'Donnell Archie Panjabi Jimi Mistry Om Puri Comedy Drama
Peter M. Cohen,Callie Thorne,Brian Van Holt,David Heyman,Comedy Romance,whipped,Peter M. Cohen Callie Thorne Brian Van Holt David Heyman Comedy Romance
Mira Nair,Indira Varma,Sarita Choudhury,Rekha,Crime Drama History Romance,kama sutra: a tale of love,Mira Nair Indira Varma Sarita Choudhury Rekha Crime Drama History Romance
Nicole Holofcener,Oliver Platt,Thomas Ian Nicholas,Ann Morgan Guilbert,Comedy Drama,please give,Nicole Holofcener Oliver Platt Thomas Ian Nicholas Ann Morgan Guilbert Comedy Drama
Mel Stuart,Peter Ostrum,Jack Albertson,Julie Dawn Cole,Family Fantasy Musical,willy wonka & the chocolate factory,Mel Stuart Peter Ostrum Jack Albertson Julie Dawn Cole Family Fantasy Musical
Anthony Hickox,Julian Sands,Zach Galligan,Paula Marshall,Fantasy Horror,warlock: the armageddon,Anthony Hickox Julian Sands Zach Galligan Paula Marshall Fantasy Horror
Tom Schulman,Kristy Swanson,George Hamilton,Dyan Cannon,Comedy Crime,8 heads in a duffel bag,Tom Schulman Kristy Swanson George Hamilton Dyan Cannon Comedy Crime
Terrence Malick,Sam Shepard,Stuart Margolin,Richard Libertini,Drama Romance,days of heaven,Terrence Malick Sam Shepard Stuart Margolin Richard Libertini Drama Romance
Jill Sprecher,Matthew McConaughey,Rob McElhenney,Amy Irving,Drama,thirteen conversations about one thing,Jill Sprecher Matthew McConaughey Rob McElhenney Amy Irving Drama
Darren Stein,Julie Benz,Judy Greer,Jeff Conaway,Comedy Crime Thriller,jawbreaker,Darren Stein Julie Benz Judy Greer Jeff Conaway Comedy Crime Thriller
Julian Schnabel,Gary Oldman,Michael Wincott,Courtney Love,Biography Drama,basquiat,Julian Schnabel Gary Oldman Michael Wincott Courtney Love Biography Drama
Noah Baumbach,Greta Gerwig,Grace Gummer,Vanessa Ray,Comedy Drama Romance,frances ha,Noah Baumbach Greta Gerwig Grace Gummer Vanessa Ray Comedy Drama Romance
Gavin Hood,Terry Pheto,Nambitha Mpumlwana,Rapulana Seiphemo,Crime Drama,tsotsi,Gavin Hood Terry Pheto Nambitha Mpumlwana Rapulana Seiphemo Crime Drama
Todd Solondz,Philip Seymour Hoffman,Jon Lovitz,Dylan Baker,Comedy Drama,happiness,Todd Solondz Philip Seymour Hoffman Jon Lovitz Dylan Baker Comedy Drama
George Gallo,Eddie Griffin,Joe Howard,Robert Noble,Comedy Documentary,dysfunktional family,George Gallo Eddie Griffin Joe Howard Robert Noble Comedy Documentary
Kevin Smith,Johnny Depp,Haley Joel Osment,Michael Parks,Comedy Drama Horror,tusk,Kevin Smith Johnny Depp Haley Joel Osment Michael Parks Comedy Drama Horror
Chan-wook Park,Min-sik Choi,Ji-tae Yu,Hye-jeong Kang,Drama Mystery Thriller,oldboy,Chan-wook Park Min-sik Choi Ji-tae Yu Hye-jeong Kang Drama Mystery Thriller
David Nixon,Robyn Lively,Michael Bolten,Christopher Schmidt,Drama Family,letters to god,David Nixon Robyn Lively Michael Bolten Christopher Schmidt Drama Family
Jason Eisener,Gregory Smith,Robb Wells,Molly Dunsworth,Action Comedy Thriller,hobo with a shotgun,Jason Eisener Gregory Smith Robb Wells Molly Dunsworth Action Comedy Thriller
Enrique Begne,Kevin Pollak,Héctor Jiménez,Erick Elias,Action Comedy,compadres,Enrique Begne Kevin Pollak Héctor Jiménez Erick Elias Action Comedy
Matthew Bright,Bokeem Woodbine,Dan Hedaya,Robert Peters,Comedy Crime Drama Thriller,freeway,Matthew Bright Bokeem Woodbine Dan Hedaya Robert Peters Comedy Crime Drama Thriller
Michael Landon Jr.,William Morgan Sheppard,Kevin Gage,Brianna Brown,Drama Family Western,love's abiding joy,Michael Landon Jr. William Morgan Sheppard Kevin Gage Brianna Brown Drama Family Western
Andrea Arnold,Michael Fassbender,Harry Treadaway,Jason Maza,Drama,fish tank,Andrea Arnold Michael Fassbender Harry Treadaway Jason Maza Drama
Whit Stillman,Greta Gerwig,Megalyn Echikunwoke,Zach Woods,Comedy Drama Romance,damsels in distress,Whit Stillman Greta Gerwig Megalyn Echikunwoke Zach Woods Comedy Drama Romance
Unknown,Craig T. Nelson,Colm Feore,Megalyn Echikunwoke,Horror Sci-Fi Thriller,creature            ,Unknown Craig T. Nelson Colm Feore Megalyn Echikunwoke Horror Sci-Fi Thriller
Leslye Headland,Kirsten Dunst,Adam Scott,Andrew Rannells,Comedy Romance,bachelorette,Leslye Headland Kirsten Dunst Adam Scott Andrew Rannells Comedy Romance
Unknown,Danny Pino,Megan Hilty,Zach Grenier,Comedy Drama Horror Sci-Fi Thriller,braindead            ,Unknown Danny Pino Megan Hilty Zach Grenier Comedy Drama Horror Sci-Fi Thriller
Bobby Roth,Virginia Madsen,Aaron Ashmore,Lindsey Haun,Drama Family Music,brave new girl,Bobby Roth Virginia Madsen Aaron Ashmore Lindsey Haun Drama Family Music
Tim Heidecker,Michael Gross,William Atherton,Bob Ross,Comedy,tim and eric's billion dollar movie,Tim Heidecker Michael Gross William Atherton Bob Ross Comedy
Rupert Wyatt,George Kennedy,Cjon Saulsberry,Griffin Cleveland,Crime Drama Thriller,the gambler,Rupert Wyatt George Kennedy Cjon Saulsberry Griffin Cleveland Crime Drama Thriller
Unknown,Susan Hampshire,Amanda Mealing,Tim Healy,Drama,the grand            ,Unknown Susan Hampshire Amanda Mealing Tim Healy Drama
Marco Kreuzpaintner,Alicja Bachleda,Kostja Ullmann,Robert Stadlober,Comedy Drama Romance Sport,summer storm,Marco Kreuzpaintner Alicja Bachleda Kostja Ullmann Robert Stadlober Comedy Drama Romance Sport
Kate Connor,Johnny Pacar,Eric Stoltz,Brendan Fehr,Drama History War,fort mccoy,Kate Connor Johnny Pacar Eric Stoltz Brendan Fehr Drama History War
Deon Taylor,Matt Cohen,Betsy Russell,Noah Segan,Horror Thriller,chain letter,Deon Taylor Matt Cohen Betsy Russell Noah Segan Horror Thriller
Jason Alexander,Gretchen Mol,Patti LuPone,Peter Onorati,Comedy Drama,just looking,Jason Alexander Gretchen Mol Patti LuPone Peter Onorati Comedy Drama
