director_name,actor_1_name,actor_2_name,actor_3_name,genres,movie_title,comb
Michael Chapman,Curtis Armstrong,Pamela Reed,Mike Muscat,Adventure Drama Fantasy,the clan of the cave bear,Michael Chapman Curtis Armstrong Pamela Reed Mike Muscat Adventure Drama Fantasy
Antonio Banderas,Meat Loaf,Elizabeth Perkins,Noah Emmerich,Comedy Crime Drama,crazy in alabama,Antonio Banderas Meat Loaf Elizabeth Perkins Noah Emmerich Comedy Crime Drama
Michael Haneke,Naomi Watts,Siobhan Fallon Hogan,Brady Corbet,Crime Drama Horror Thriller,funny games,Michael Haneke Naomi Watts Siobhan Fallon Hogan Brady Corbet Crime Drama Horror Thriller
Khalil Sullins,Thomas Stroppel,Kalim Chandler,Amber Marie Bollinger,Drama Sci-Fi Thriller,listening,Khalil Sullins Thomas Stroppel Kalim Chandler Amber Marie Bollinger Drama Sci-Fi Thriller
Atom Egoyan,Bob Hoskins,Elaine Cassidy,Gerard McSorley,Drama Thriller,felicia's journey,Atom Egoyan Bob Hoskins Elaine Cassidy Gerard McSorley Drama Thriller
Fritz Lang,Brigitte Helm,Gustav Fröhlich,Rudolf Klein-Rogge,Drama Sci-Fi,metropolis,Fritz Lang Brigitte Helm Gustav Fröhlich Rudolf Klein-Rogge Drama Sci-Fi
Pierre Morel,David Belle,Cyril Raffaelli,Dany Verissimo-Petit,Action Crime Thriller,district b13,Pierre Morel David Belle Cyril Raffaelli Dany Verissimo-Petit Action Crime Thriller
Gary Fleder,Steve Buscemi,Bill Cobbs,Treat Williams,Crime Drama,things to do in denver when you're dead,Gary Fleder Steve Buscemi Bill Cobbs Treat Williams Crime Drama
Hsiao-Hsien Hou,Qi Shu,Chen Chang,Satoshi Tsumabuki,Action Drama,the assassin,Hsiao-Hsien Hou Qi Shu Chen Chang Satoshi Tsumabuki Action Drama
Gregor Jordan,Dean Stockwell,Scott Glenn,Leon,Comedy Crime Drama Thriller War,buffalo soldiers,Gregor Jordan Dean Stockwell Scott Glenn Leon Comedy Crime Drama Thriller War
Andrey Zvyagintsev,Konstantin Lavronenko,Vladimir Garin,Nataliya Vdovina,Drama Mystery Thriller,the return,Andrey Zvyagintsev Konstantin Lavronenko Vladimir Garin Nataliya Vdovina Drama Mystery Thriller
Tony Jaa,Nirut Sirichanya,Petchtai Wongkamlao,Sarunyu Wongkrachang,Action,ong-bak 2,Tony Jaa Nirut Sirichanya Petchtai Wongkamlao Sarunyu Wongkrachang Action
Neil Marshall,Michael Fassbender,JJ Feild,Dave Legeno,Action Adventure Drama History Thriller War,centurion,Neil Marshall Michael Fassbender JJ Feild Dave Legeno Action Adventure Drama History Thriller War
Russell Mulcahy,Christopher Heyerdahl,Gina Bellman,Conrad Dunn,Action Drama Thriller,silent trigger,Russell Mulcahy Christopher Heyerdahl Gina Bellman Conrad Dunn Action Drama Thriller
Ryûhei Kitamura,Bradley Cooper,Brooke Shields,Leslie Bibb,Fantasy Horror Mystery,the midnight meat train,Ryûhei Kitamura Bradley Cooper Brooke Shields Leslie Bibb Fantasy Horror Mystery
Darrell Roodt,Jennifer Hudson,Wendy Crewson,Aubrey Poo,Biography Drama History,winnie mandela,Darrell Roodt Jennifer Hudson Wendy Crewson Aubrey Poo Biography Drama History
Dito Montiel,Channing Tatum,Al Pacino,Tracy Morgan,Crime Drama Thriller,the son of no one,Dito Montiel Channing Tatum Al Pacino Tracy Morgan Crime Drama Thriller
Stefan Ruzowitzky,Eddie Izzard,Udo Kier,Edward Fox,Action Comedy Drama War,all the queen's men,Stefan Ruzowitzky Eddie Izzard Udo Kier Edward Fox Action Comedy Drama War
Jake Paltrow,Stephen Graham,Gael Le Cornec,Keith Allen,Comedy Drama Fantasy Music Romance,the good night,Jake Paltrow Stephen Graham Gael Le Cornec Keith Allen Comedy Drama Fantasy Music Romance
Juraj Jakubisko,Anna Friel,Hans Matheson,Franco Nero,Biography Drama Fantasy History,bathory: countess of blood,Juraj Jakubisko Anna Friel Hans Matheson Franco Nero Biography Drama Fantasy History
Anthony Silverston,Liam Neeson,Steve Buscemi,Loretta Devine,Adventure Animation Family,khumba,Anthony Silverston Liam Neeson Steve Buscemi Loretta Devine Adventure Animation Family
Gabe Ibáñez,Birgitte Hjort Sørensen,Robert Forster,Melanie Griffith,Action Sci-Fi Thriller,automata,Gabe Ibáñez Birgitte Hjort Sørensen Robert Forster Melanie Griffith Action Sci-Fi Thriller
Gerry Lively,Bruce Payne,Lucy Gaskell,Steven Elder,Action Adventure Fantasy,dungeons & dragons: wrath of the dragon god,Gerry Lively Bruce Payne Lucy Gaskell Steven Elder Action Adventure Fantasy
Daniele Luchetti,Maximilian Dirr,Rodrigo De la Serna,Ferdinando Vetere,Biography,chiamatemi francesco - il papa della gente,Daniele Luchetti Maximilian Dirr Rodrigo De la Serna Ferdinando Vetere Biography
Tung-Shing Yee,Bingbing Fan,Daniel Wu,Yasuaki Kurata,Action Crime Drama Thriller,shinjuku incident,Tung-Shing Yee Bingbing Fan Daniel Wu Yasuaki Kurata Action Crime Drama Thriller
Julien Temple,Samantha Morton,Dexter Fletcher,Linus Roache,Biography Drama,pandaemonium,Julien Temple Samantha Morton Dexter Fletcher Linus Roache Biography Drama
Harold Ramis,Bill Murray,Chris Elliott,Willie Garson,Comedy Fantasy Romance,groundhog day,Harold Ramis Bill Murray Chris Elliott Willie Garson Comedy Fantasy Romance
Gregory Jacobs,Matt Bomer,Channing Tatum,Kevin Nash,Comedy Drama Music,magic mike xxl,Gregory Jacobs Matt Bomer Channing Tatum Kevin Nash Comedy Drama Music
Baz Luhrmann,Leonardo DiCaprio,Harold Perrineau,Brian Dennehy,Drama Romance,romeo + juliet,Baz Luhrmann Leonardo DiCaprio Harold Perrineau Brian Dennehy Drama Romance
Gilles Paquet-Brenner,Kristin Scott Thomas,Aidan Quinn,Arben Bajraktaraj,Drama War,sarah's key,Gilles Paquet-Brenner Kristin Scott Thomas Aidan Quinn Arben Bajraktaraj Drama War
Peter Cousens,Sharon Leal,David Rasche,Bart Shatto,Drama Family Music,freedom,Peter Cousens Sharon Leal David Rasche Bart Shatto Drama Family Music
Clint Eastwood,Clint Eastwood,Morgan Freeman,Frances Fisher,Drama Western,unforgiven,Clint Eastwood Clint Eastwood Morgan Freeman Frances Fisher Drama Western
Lars von Trier,Bryce Dallas Howard,Jeremy Davies,Jean-Marc Barr,Drama,manderlay,Lars von Trier Bryce Dallas Howard Jeremy Davies Jean-Marc Barr Drama
Danny Boyle,Anil Kapoor,Saurabh Shukla,Ayush Mahesh Khedekar,Drama Romance,slumdog millionaire,Danny Boyle Anil Kapoor Saurabh Shukla Ayush Mahesh Khedekar Drama Romance
Adrian Lyne,Fred Gwynne,Lois Smith,Anne Archer,Drama Romance Thriller,fatal attraction,Adrian Lyne Fred Gwynne Lois Smith Anne Archer Drama Romance Thriller
Garry Marshall,Julia Roberts,Hector Elizondo,Jason Alexander,Comedy Romance,pretty woman,Garry Marshall Julia Roberts Hector Elizondo Jason Alexander Comedy Romance
John Blanchard,Martin Short,Andrea Martin,Joe Flaherty,Comedy,towering inferno            ,John Blanchard Martin Short Andrea Martin Joe Flaherty Comedy
John Cornell,Paul Hogan,Linda Kozlowski,John Meillon,Action Adventure Comedy,crocodile dundee ii,John Cornell Paul Hogan Linda Kozlowski John Meillon Action Adventure Comedy
Vidhu Vinod Chopra,María Valverde,Chris Marquette,Chad Bishop,Action Crime Drama Mystery Thriller,broken horses,Vidhu Vinod Chopra María Valverde Chris Marquette Chad Bishop Action Crime Drama Mystery Thriller
Oliver Stone,Tom Cruise,Tom Berenger,Stephen Baldwin,Biography Drama War,born on the fourth of july,Oliver Stone Tom Cruise Tom Berenger Stephen Baldwin Biography Drama War
Jon Turteltaub,Doug E. Doug,Leon,Malik Yoba,Adventure Comedy Family Sport,cool runnings,Jon Turteltaub Doug E. Doug Leon Malik Yoba Adventure Comedy Family Sport
Patrick Lussier,Jensen Ackles,Jaime King,Edi Gathegi,Horror Thriller,my bloody valentine,Patrick Lussier Jensen Ackles Jaime King Edi Gathegi Horror Thriller
Ole Bornedal,Kyra Sedgwick,Madison Davenport,Natasha Calis,Horror Thriller,the possession,Ole Bornedal Kyra Sedgwick Madison Davenport Natasha Calis Horror Thriller
Ted Kotcheff,Sylvester Stallone,Brian Dennehy,Chris Mulkey,Action Adventure Drama,first blood,Ted Kotcheff Sylvester Stallone Brian Dennehy Chris Mulkey Action Adventure Drama
Sylvain White,Chris Brown,Laz Alonso,Harry Lennix,Drama Music Romance,stomp the yard,Sylvain White Chris Brown Laz Alonso Harry Lennix Drama Music Romance
Lewis Gilbert,Caroline Munro,Desmond Llewelyn,Barbara Bach,Action Adventure Sci-Fi Thriller,the spy who loved me,Lewis Gilbert Caroline Munro Desmond Llewelyn Barbara Bach Action Adventure Sci-Fi Thriller
Unknown,Amy Bruni,Steve Gonsalves,Jason Hawes,Documentary,ghost hunters            ,Unknown Amy Bruni Steve Gonsalves Jason Hawes Documentary
Jamie Blanks,Alicia Witt,Loretta Devine,Julian Richings,Horror Mystery Thriller,urban legend,Jamie Blanks Alicia Witt Loretta Devine Julian Richings Horror Mystery Thriller
Stephen Frears,Keanu Reeves,Peter Capaldi,Swoosie Kurtz,Drama Romance,dangerous liaisons,Stephen Frears Keanu Reeves Peter Capaldi Swoosie Kurtz Drama Romance
Tyler Perry,Eddie Cibrian,Phylicia Rashad,Jamie Kennedy,Comedy Drama Romance,good deeds,Tyler Perry Eddie Cibrian Phylicia Rashad Jamie Kennedy Comedy Drama Romance
Randal Kleiser,Seymour Cassel,Klaus Maria Brandauer,Susan Hogan,Adventure Drama,white fang,Randal Kleiser Seymour Cassel Klaus Maria Brandauer Susan Hogan Adventure Drama
Bruce McCulloch,Will Ferrell,Elaine Hendrix,Molly Shannon,Comedy Romance,superstar,Bruce McCulloch Will Ferrell Elaine Hendrix Molly Shannon Comedy Romance
Phyllida Lloyd,Meryl Streep,Jim Broadbent,Olivia Colman,Biography Drama History,the iron lady,Phyllida Lloyd Meryl Streep Jim Broadbent Olivia Colman Biography Drama History
Mike Nawrocki,Phil Vischer,Mike Nawrocki,Shelby Vischer,Adventure Animation Comedy Drama Family Musical,jonah: a veggietales movie,Mike Nawrocki Phil Vischer Mike Nawrocki Shelby Vischer Adventure Animation Comedy Drama Family Musical
John Singleton,Janet Jackson,Khandi Alexander,Maya Angelou,Drama Romance,poetic justice,John Singleton Janet Jackson Khandi Alexander Maya Angelou Drama Romance
Kevin Bray,Mike Epps,Roger Guenveur Smith,Gino Salvano,Action Comedy Crime Thriller,all about the benjamins,Kevin Bray Mike Epps Roger Guenveur Smith Gino Salvano Action Comedy Crime Thriller
Wes Craven,John Witherspoon,W. Earl Brown,Allen Payne,Comedy Fantasy Horror Romance,vampire in brooklyn,Wes Craven John Witherspoon W. Earl Brown Allen Payne Comedy Fantasy Horror Romance
John Boorman,Linda Blair,Richard Burton,Ned Beatty,Horror,exorcist ii: the heretic,John Boorman Linda Blair Richard Burton Ned Beatty Horror
Courtney Solomon,Sissy Spacek,James D'Arcy,Vernon Dobtcheff,Horror Mystery Thriller,an american haunting,Courtney Solomon Sissy Spacek James D'Arcy Vernon Dobtcheff Horror Mystery Thriller
David Zucker,Carmen Electra,Tyler Labine,Molly Shannon,Comedy Romance,my boss's daughter,David Zucker Carmen Electra Tyler Labine Molly Shannon Comedy Romance
David Twohy,Chris Hemsworth,Milla Jovovich,Marley Shelton,Adventure Mystery Thriller,a perfect getaway,David Twohy Chris Hemsworth Milla Jovovich Marley Shelton Adventure Mystery Thriller
Rick Famuyiwa,America Ferrera,Lance Gross,Lupe Ontiveros,Comedy Romance,our family wedding,Rick Famuyiwa America Ferrera Lance Gross Lupe Ontiveros Comedy Romance
Alan Cohn,Alyson Hannigan,Linda Cardellini,Poppy Montgomery,Comedy,dead man on campus,Alan Cohn Alyson Hannigan Linda Cardellini Poppy Montgomery Comedy
Franco Zeffirelli,Lily Tomlin,Joan Plowright,Paolo Seganti,Comedy Drama War,tea with mussolini,Franco Zeffirelli Lily Tomlin Joan Plowright Paolo Seganti Comedy Drama War
Tom Holland,Joe Mantegna,Bethany Joy Lenz,Kari Wuhrer,Fantasy Horror,thinner,Tom Holland Joe Mantegna Bethany Joy Lenz Kari Wuhrer Fantasy Horror
Martin Scorsese,Robert De Niro,Liza Minnelli,Mary Kay Place,Drama Music Musical Romance,"new york, new york",Martin Scorsese Robert De Niro Liza Minnelli Mary Kay Place Drama Music Musical Romance
Spike Lee,Alfre Woodard,Delroy Lindo,Isaiah Washington,Comedy Drama,crooklyn,Spike Lee Alfre Woodard Delroy Lindo Isaiah Washington Comedy Drama
Chris Rock,Steve Buscemi,Eliza Coupe,Wendell Pierce,Comedy Drama Romance,i think i love my wife,Chris Rock Steve Buscemi Eliza Coupe Wendell Pierce Comedy Drama Romance
James Isaac,Peter Mensah,Kane Hodder,Lexa Doig,Action Horror Sci-Fi Thriller,jason x,James Isaac Peter Mensah Kane Hodder Lexa Doig Action Horror Sci-Fi Thriller
Shawn Levy,Frankie Muniz,Donald Faison,Lee Majors,Adventure Comedy Family,big fat liar,Shawn Levy Frankie Muniz Donald Faison Lee Majors Adventure Comedy Family
Emilio Estevez,Anthony Hopkins,Nick Cannon,Brian Geraghty,Drama History,bobby,Emilio Estevez Anthony Hopkins Nick Cannon Brian Geraghty Drama History
Mark Waters,Monica Potter,Ivana Milicevic,China Chow,Comedy Mystery Romance,head over heels,Mark Waters Monica Potter Ivana Milicevic China Chow Comedy Mystery Romance
Josh Schwartz,Thomas McDonell,Jackson Nicoll,Osric Chau,Adventure Comedy,fun size,Josh Schwartz Thomas McDonell Jackson Nicoll Osric Chau Adventure Comedy
Julian Schnabel,Emmanuelle Seigner,Mathieu Amalric,Isaach De Bankolé,Biography Drama,the diving bell and the butterfly,Julian Schnabel Emmanuelle Seigner Mathieu Amalric Isaach De Bankolé Biography Drama
Todd Field,Kate Winslet,Noah Emmerich,Jane Adams,Drama Romance,little children,Todd Field Kate Winslet Noah Emmerich Jane Adams Drama Romance
Davis Guggenheim,Norman Reedus,Sharon Lawrence,Noam Jenkins,Drama Mystery Thriller,gossip,Davis Guggenheim Norman Reedus Sharon Lawrence Noam Jenkins Drama Mystery Thriller
Tony Goldwyn,Viggo Mortensen,Julie Kavner,Tovah Feldshuh,Drama,a walk on the moon,Tony Goldwyn Viggo Mortensen Julie Kavner Tovah Feldshuh Drama
Phillip Noyce,Derek Luke,Terry Pheto,Bonnie Henna,Biography Drama History,catch a fire,Phillip Noyce Derek Luke Terry Pheto Bonnie Henna Biography Drama History
Stephen Carpenter,Melissa Sagemiller,Angela Featherstone,Candace Kroslak,Drama Horror Mystery Thriller,soul survivors,Stephen Carpenter Melissa Sagemiller Angela Featherstone Candace Kroslak Drama Horror Mystery Thriller
James Ivory,Seth Gilliam,Todd Boyce,Nigel Whitmey,Biography Drama History Romance,jefferson in paris,James Ivory Seth Gilliam Todd Boyce Nigel Whitmey Biography Drama History Romance
Stephan Elliott,Colin Firth,Kristin Scott Thomas,Kris Marshall,Comedy Romance,easy virtue,Stephan Elliott Colin Firth Kristin Scott Thomas Kris Marshall Comedy Romance
James Fargo,Christopher Lee,Joseph Cotten,Behrouz Vossoughi,Action Adventure History,caravans,James Fargo Christopher Lee Joseph Cotten Behrouz Vossoughi Action Adventure History
Mike Leigh,Lesley Manville,Ruth Sheen,Karl Johnson,Biography Drama History,mr. turner,Mike Leigh Lesley Manville Ruth Sheen Karl Johnson Biography Drama History
Alain Resnais,Mathieu Amalric,Sara Forestier,Edouard Baer,Drama Romance,wild grass,Alain Resnais Mathieu Amalric Sara Forestier Edouard Baer Drama Romance
Costa-Gavras,Sebastian Koch,Mathieu Kassovitz,Ulrich Mühe,Biography Crime Drama War,amen.,Costa-Gavras Sebastian Koch Mathieu Kassovitz Ulrich Mühe Biography Crime Drama War
Chao-Bin Su,Woo-sung Jung,Shawn Yue,Kelly Lin,Action,reign of assassins,Chao-Bin Su Woo-sung Jung Shawn Yue Kelly Lin Action
Neil Burger,John Heard,Katherine LaNasa,Mark L. Young,Comedy Drama War,the lucky ones,Neil Burger John Heard Katherine LaNasa Mark L. Young Comedy Drama War
Kenneth Lonergan,Matt Damon,Kieran Culkin,John Gallagher Jr.,Drama,margaret,Kenneth Lonergan Matt Damon Kieran Culkin John Gallagher Jr. Drama
Bo Zenga,Steve Howey,Kenan Thompson,Diora Baird,Comedy Horror,stan helsing,Bo Zenga Steve Howey Kenan Thompson Diora Baird Comedy Horror
Rob Reiner,Madeline Carroll,Rebecca De Mornay,Aidan Quinn,Comedy Drama Romance,flipped,Rob Reiner Madeline Carroll Rebecca De Mornay Aidan Quinn Comedy Drama Romance
Ang Lee,Jake Gyllenhaal,Heath Ledger,Anne Hathaway,Drama Romance,brokeback mountain,Ang Lee Jake Gyllenhaal Heath Ledger Anne Hathaway Drama Romance
Jonathan Liebesman,Noel Fisher,Danny Woodburn,Jeremy Howard,Action Adventure Comedy Sci-Fi,teenage mutant ninja turtles,Jonathan Liebesman Noel Fisher Danny Woodburn Jeremy Howard Action Adventure Comedy Sci-Fi
Amy Heckerling,Donald Faison,Dan Hedaya,Elisa Donovan,Comedy Romance,clueless,Amy Heckerling Donald Faison Dan Hedaya Elisa Donovan Comedy Romance
Todd Haynes,Dennis Quaid,Celia Weston,Michael Gaston,Drama Romance,far from heaven,Todd Haynes Dennis Quaid Celia Weston Michael Gaston Drama Romance
Steve Pink,Adam Scott,Gillian Jacobs,Collette Wolfe,Comedy Sci-Fi,hot tub time machine 2,Steve Pink Adam Scott Gillian Jacobs Collette Wolfe Comedy Sci-Fi
Philip Kaufman,Kate Winslet,Stephen Marcus,Amelia Warner,Biography Drama,quills,Philip Kaufman Kate Winslet Stephen Marcus Amelia Warner Biography Drama
Martin McDonagh,Abbie Cornish,Gabourey Sidibe,Michael Stuhlbarg,Comedy Crime,seven psychopaths,Martin McDonagh Abbie Cornish Gabourey Sidibe Michael Stuhlbarg Comedy Crime
Kasi Lemmons,Colm Feore,Tamara Tunie,Aunjanue Ellis,Crime Drama Music Mystery Thriller,the caveman's valentine,Kasi Lemmons Colm Feore Tamara Tunie Aunjanue Ellis Crime Drama Music Mystery Thriller
Unknown,Jacek Koman,Marian Dziedziel,Jaroslaw Boberek,Action Crime Drama Thriller,the border            ,Unknown Jacek Koman Marian Dziedziel Jaroslaw Boberek Action Crime Drama Thriller
Oliver Hirschbiegel,Thomas Kretschmann,Bruno Ganz,Alexandra Maria Lara,Biography Drama History War,downfall,Oliver Hirschbiegel Thomas Kretschmann Bruno Ganz Alexandra Maria Lara Biography Drama History War
Alejandro Amenábar,Belén Rueda,Lola Dueñas,Tamar Novas,Biography Drama Romance,the sea inside,Alejandro Amenábar Belén Rueda Lola Dueñas Tamar Novas Biography Drama Romance
Jonathan Glazer,Scarlett Johansson,Paul Brannigan,Alison Chand,Drama Horror Sci-Fi Thriller,under the skin,Jonathan Glazer Scarlett Johansson Paul Brannigan Alison Chand Drama Horror Sci-Fi Thriller
Barry Levinson,Robin Williams,J.T. Walsh,Bruno Kirby,Biography Comedy Drama War,"good morning, vietnam",Barry Levinson Robin Williams J.T. Walsh Bruno Kirby Biography Comedy Drama War
Hyung-rae Shim,Jason Mewes,Stephanie Danielson,Michael Rispoli,Comedy,the last godfather,Hyung-rae Shim Jason Mewes Stephanie Danielson Michael Rispoli Comedy
Jon M. Chu,Usher Raymond,Sean Kingston,Boys II Men,Documentary Music,justin bieber: never say never,Jon M. Chu Usher Raymond Sean Kingston Boys II Men Documentary Music
Darren Aronofsky,Natalie Portman,Mila Kunis,Mark Margolis,Drama Thriller,black swan,Darren Aronofsky Natalie Portman Mila Kunis Mark Margolis Drama Thriller
José Padilha,Gary Oldman,Abbie Cornish,Jennifer Ehle,Action Crime Sci-Fi Thriller,robocop,José Padilha Gary Oldman Abbie Cornish Jennifer Ehle Action Crime Sci-Fi Thriller
Francis Ford Coppola,Robert De Niro,Al Pacino,Robert Duvall,Crime Drama,the godfather: part ii,Francis Ford Coppola Robert De Niro Al Pacino Robert Duvall Crime Drama
Thomas Carter,Sean Patrick Thomas,Terry Kinney,Fredro Starr,Drama Music Romance,save the last dance,Thomas Carter Sean Patrick Thomas Terry Kinney Fredro Starr Drama Music Romance
Renny Harlin,Tuesday Knight,Rodney Eastman,Brooke Bundy,Fantasy Horror Thriller,a nightmare on elm street 4: the dream master,Renny Harlin Tuesday Knight Rodney Eastman Brooke Bundy Fantasy Horror Thriller
Patricia Riggen,Jennifer Garner,Brighton Sharbino,Martin Henderson,Drama,miracles from heaven,Patricia Riggen Jennifer Garner Brighton Sharbino Martin Henderson Drama
Danny Leiner,Jennifer Garner,Mary Lynn Rajskub,Marla Sokoloff,Comedy Mystery,"dude, where's my car?",Danny Leiner Jennifer Garner Mary Lynn Rajskub Marla Sokoloff Comedy Mystery
Christopher Cain,Jack Palance,Patrick Wayne,Brian Keith,Action Crime Drama Thriller Western,young guns,Christopher Cain Jack Palance Patrick Wayne Brian Keith Action Crime Drama Thriller Western
Theodore Melfi,Bill Murray,Naomi Watts,Reg E. Cathey,Comedy Drama,st. vincent,Theodore Melfi Bill Murray Naomi Watts Reg E. Cathey Comedy Drama
Steve Pink,Joe Lo Truglio,Regina Hall,Bryan Callen,Comedy Romance,about last night,Steve Pink Joe Lo Truglio Regina Hall Bryan Callen Comedy Romance
Gil Junger,Joseph Gordon-Levitt,Heath Ledger,Andrew Keegan,Comedy Drama Romance,10 things i hate about you,Gil Junger Joseph Gordon-Levitt Heath Ledger Andrew Keegan Comedy Drama Romance
Ed Decter,Zooey Deschanel,Eddie Griffin,Gene Simmons,Comedy,the new guy,Ed Decter Zooey Deschanel Eddie Griffin Gene Simmons Comedy
Gene Quintano,Jon Lovitz,Lin Shaye,Bill Nunn,Action Comedy Crime,loaded weapon 1,Gene Quintano Jon Lovitz Lin Shaye Bill Nunn Action Comedy Crime
Jaume Collet-Serra,Óscar Jaenada,Brett Cullen,Sedona Legge,Drama Horror Thriller,the shallows,Jaume Collet-Serra Óscar Jaenada Brett Cullen Sedona Legge Drama Horror Thriller
Eric Bress,Logan Lerman,Eric Stoltz,Cameron Bright,Sci-Fi Thriller,the butterfly effect,Eric Bress Logan Lerman Eric Stoltz Cameron Bright Sci-Fi Thriller
Chris Koch,Chris Elliott,Mark Webber,Jean Smart,Adventure Comedy Family,snow day,Chris Koch Chris Elliott Mark Webber Jean Smart Adventure Comedy Family
Preston A. Whitmore II,Mekhi Phifer,Chris Brown,Loretta Devine,Comedy Drama Romance,this christmas,Preston A. Whitmore II Mekhi Phifer Chris Brown Loretta Devine Comedy Drama Romance
Bob Clark,Kathleen Turner,Dom DeLuise,Ruby Dee,Comedy Crime Family Sci-Fi,baby geniuses,Bob Clark Kathleen Turner Dom DeLuise Ruby Dee Comedy Crime Family Sci-Fi
Kirk Wong,Bokeem Woodbine,Elliott Gould,Antonio Sabato Jr.,Action Comedy Crime Thriller,the big hit,Kirk Wong Bokeem Woodbine Elliott Gould Antonio Sabato Jr. Action Comedy Crime Thriller
Bronwen Hughes,Gregory Smith,Eartha Kitt,Charlotte Sullivan,Comedy Drama Family,harriet the spy,Bronwen Hughes Gregory Smith Eartha Kitt Charlotte Sullivan Comedy Drama Family
John Lafia,Jenny Agutter,Beth Grant,Greg Germann,Fantasy Horror,child's play 2,John Lafia Jenny Agutter Beth Grant Greg Germann Fantasy Horror
Sam Miller,Leslie Bibb,Kate del Castillo,Henry Simmons,Crime Thriller,no good deed,Sam Miller Leslie Bibb Kate del Castillo Henry Simmons Crime Thriller
Frank Darabont,Toby Jones,Alexa Davalos,Jeffrey DeMunn,Horror,the mist,Frank Darabont Toby Jones Alexa Davalos Jeffrey DeMunn Horror
Alex Garland,Elina Alminas,Sonoya Mizuno,Corey Johnson,Drama Mystery Sci-Fi Thriller,ex machina,Alex Garland Elina Alminas Sonoya Mizuno Corey Johnson Drama Mystery Sci-Fi Thriller
Spike Jonze,Willie Garson,Orson Bean,Mary Kay Place,Comedy Drama Fantasy,being john malkovich,Spike Jonze Willie Garson Orson Bean Mary Kay Place Comedy Drama Fantasy
Mark Brown,Mo'Nique,Vivica A. Fox,Tamala Jones,Comedy Romance,two can play that game,Mark Brown Mo'Nique Vivica A. Fox Tamala Jones Comedy Romance
Dave Green,Teo Halm,Ella Wahlestedt,Jason Gray-Stanford,Adventure Family Sci-Fi,earth to echo,Dave Green Teo Halm Ella Wahlestedt Jason Gray-Stanford Adventure Family Sci-Fi
John Stockwell,Kirsten Dunst,Jay Hernandez,Rolando Molina,Drama Romance,crazy/beautiful,John Stockwell Kirsten Dunst Jay Hernandez Rolando Molina Drama Romance
Clint Eastwood,Yuki Matsuzaki,Kazunari Ninomiya,Shidô Nakamura,Drama History War,letters from iwo jima,Clint Eastwood Yuki Matsuzaki Kazunari Ninomiya Shidô Nakamura Drama History War
Michael Polish,J.K. Simmons,Virginia Madsen,Bruce Dern,Adventure Drama Sci-Fi,the astronaut farmer,Michael Polish J.K. Simmons Virginia Madsen Bruce Dern Adventure Drama Sci-Fi
Daisy von Scherler Mayer,LL Cool J,Jada Pinkett Smith,Dave Chappelle,Comedy Romance,woo,Daisy von Scherler Mayer LL Cool J Jada Pinkett Smith Dave Chappelle Comedy Romance
Lenny Abrahamson,Joan Allen,Jacob Tremblay,Cas Anvar,Drama,room,Lenny Abrahamson Joan Allen Jacob Tremblay Cas Anvar Drama
Bob Saget,Don Rickles,Jack Warden,Traylor Howard,Comedy,dirty work,Bob Saget Don Rickles Jack Warden Traylor Howard Comedy
John Waters,Kathleen Turner,Sam Waterston,Traci Lords,Comedy Crime Thriller,serial mom,John Waters Kathleen Turner Sam Waterston Traci Lords Comedy Crime Thriller
Andrew Fleming,Ryan Reynolds,Will Ferrell,Kirsten Dunst,Comedy,dick,Andrew Fleming Ryan Reynolds Will Ferrell Kirsten Dunst Comedy
Niels Arden Oplev,Michael Nyqvist,David Dencik,Lena Endre,Action Crime Mystery Thriller,del 1 - män som hatar kvinnor            ,Niels Arden Oplev Michael Nyqvist David Dencik Lena Endre Action Crime Mystery Thriller
Craig Bolotin,Rosario Dawson,Vanessa Williams,Robert Ri'chard,Drama Thriller,light it up,Craig Bolotin Rosario Dawson Vanessa Williams Robert Ri'chard Drama Thriller
Mark Christopher,Salma Hayek,Ellen Albertini Dow,Sela Ward,Drama Music,54,Mark Christopher Salma Hayek Ellen Albertini Dow Sela Ward Drama Music
Blair Hayes,Jake Gyllenhaal,Geoffrey Arend,Marley Shelton,Adventure Comedy Romance Sci-Fi,bubble boy,Blair Hayes Jake Gyllenhaal Geoffrey Arend Marley Shelton Adventure Comedy Romance Sci-Fi
Jez Butterworth,Mark Gatiss,Mathieu Kassovitz,Ben Chaplin,Comedy Crime Thriller,birthday girl,Jez Butterworth Mark Gatiss Mathieu Kassovitz Ben Chaplin Comedy Crime Thriller
Jon Lucas,Justin Chon,Josie Loren,Sarah Wright,Comedy,21 & over,Jon Lucas Justin Chon Josie Loren Sarah Wright Comedy
Olivier Assayas,Steve Buscemi,Miranda Richardson,Catalina Sandino Moreno,Comedy Drama Romance,"paris, je t'aime",Olivier Assayas Steve Buscemi Miranda Richardson Catalina Sandino Moreno Comedy Drama Romance
Rod Lurie,Harry Lennix,Kathryn Morris,Peter Coyote,Drama Sport,resurrecting the champ,Rod Lurie Harry Lennix Kathryn Morris Peter Coyote Drama Sport
Paul Weitz,Tina Fey,Sarita Choudhury,Christopher Evan Welch,Comedy Drama Romance,admission,Paul Weitz Tina Fey Sarita Choudhury Christopher Evan Welch Comedy Drama Romance
Patrice Leconte,Emir Kusturica,Daniel Auteuil,Yves Jacques,Drama Romance,the widow of saint-pierre,Patrice Leconte Emir Kusturica Daniel Auteuil Yves Jacques Drama Romance
Atom Egoyan,Liam Neeson,Meghan Heffern,Natalie Lisinska,Drama Mystery Romance Thriller,chloe,Atom Egoyan Liam Neeson Meghan Heffern Natalie Lisinska Drama Mystery Romance Thriller
Paul Mazursky,Chazz Palminteri,Ryan O'Neal,Paul Mazursky,Comedy Crime Drama,faithful,Paul Mazursky Chazz Palminteri Ryan O'Neal Paul Mazursky Comedy Crime Drama
