director_name,actor_1_name,actor_2_name,actor_3_name,genres,movie_title,comb
Charles S. Dutton,Omar Epps,Charles S. Dutton,Tim Daly,Biography Drama Romance Sport,against the ropes,Charles S. Dutton Omar Epps Charles S. Dutton Tim Daly Biography Drama Romance Sport
Richard Lester,Margot Kidder,Robert Vaughn,Jackie Cooper,Action Comedy Sci-Fi,superman iii,Richard Lester Margot Kidder Robert Vaughn Jackie Cooper Action Comedy Sci-Fi
Peter Segal,Robert De Niro,Sylvester Stallone,Oscar Gale,Comedy Sport,grudge match,Peter Segal Robert De Niro Sylvester Stallone Oscar Gale Comedy Sport
John Woo,Takeshi Kaneshiro,Tony Chiu Wai Leung,Wei Zhao,Action Adventure Drama History War,red cliff,John Woo Takeshi Kaneshiro Tony Chiu Wai Leung Wei Zhao Action Adventure Drama History War
Andy Tennant,Ethan Embry,Mary Lynn Rajskub,Courtney Gains,Comedy Romance,sweet home alabama,Andy Tennant Ethan Embry Mary Lynn Rajskub Courtney Gains Comedy Romance
Robert Luketic,Gerard Butler,John Michael Higgins,Eric Winter,Comedy Romance,the ugly truth,Robert Luketic Gerard Butler John Michael Higgins Eric Winter Comedy Romance
Jonathan Lynn,Austin Pendleton,Phil Hartman,Max Casella,Comedy,sgt. bilko,Jonathan Lynn Austin Pendleton Phil Hartman Max Casella Comedy
Robert Rodriguez,Steve Buscemi,Alexa PenaVega,Emily Osment,Action Adventure Comedy Family Sci-Fi,spy kids 2: island of lost dreams,Robert Rodriguez Steve Buscemi Alexa PenaVega Emily Osment Action Adventure Comedy Family Sci-Fi
David Carson,LeVar Burton,Alan Ruck,Jonathan Frakes,Action Adventure Mystery Sci-Fi Thriller,star trek: generations,David Carson LeVar Burton Alan Ruck Jonathan Frakes Action Adventure Mystery Sci-Fi Thriller
Kar-Wai Wong,Tony Chiu Wai Leung,Hye-kyo Song,Elvis Tsui,Action Biography Drama,the grandmaster,Kar-Wai Wong Tony Chiu Wai Leung Hye-kyo Song Elvis Tsui Action Biography Drama
Francis Lawrence,Robert Pattinson,Christoph Waltz,James Frain,Drama Romance,water for elephants,Francis Lawrence Robert Pattinson Christoph Waltz James Frain Drama Romance
Unknown,Joseph Gordon-Levitt,Wayne Knight,Kristen Johnston,Comedy Family Sci-Fi,3rd rock from the sun            ,Unknown Joseph Gordon-Levitt Wayne Knight Kristen Johnston Comedy Family Sci-Fi
Yuefeng Song,Blythe Auffarth,Bianca Collins,Jiao Xu,Adventure Animation Family Fantasy,dragon nest: warriors' dawn,Yuefeng Song Blythe Auffarth Bianca Collins Jiao Xu Adventure Animation Family Fantasy
Norman Jewison,Denzel Washington,Vincent Pastore,Deborah Kara Unger,Biography Drama Sport,the hurricane,Norman Jewison Denzel Washington Vincent Pastore Deborah Kara Unger Biography Drama Sport
Michael Apted,Bill Cobbs,Jeff Kober,Billy Campbell,Crime Drama Thriller,enough,Michael Apted Bill Cobbs Jeff Kober Billy Campbell Crime Drama Thriller
David Mirkin,Sarah Silverman,Anne Bancroft,Jeffrey Jones,Comedy Crime Romance,heartbreakers,David Mirkin Sarah Silverman Anne Bancroft Jeffrey Jones Comedy Crime Romance
Andy Fickman,D.B. Woodside,Daniella Alonso,Eduardo Verástegui,Action Comedy Crime,paul blart: mall cop 2,Andy Fickman D.B. Woodside Daniella Alonso Eduardo Verástegui Action Comedy Crime
Luis Mandoki,Sonia Braga,Shirley Knight,Kari Matchett,Drama Romance,angel eyes,Luis Mandoki Sonia Braga Shirley Knight Kari Matchett Drama Romance
John Pasquin,Jim Belushi,Ken Marino,Kelly Lynch,Comedy Drama,joe somebody,John Pasquin Jim Belushi Ken Marino Kelly Lynch Comedy Drama
Roman Polanski,Johnny Depp,Frank Langella,Lena Olin,Mystery Thriller,the ninth gate,Roman Polanski Johnny Depp Frank Langella Lena Olin Mystery Thriller
Michael Apted,J.K. Simmons,Paul Guilfoyle,Bill Nunn,Crime Drama Mystery Thriller,extreme measures,Michael Apted J.K. Simmons Paul Guilfoyle Bill Nunn Crime Drama Mystery Thriller
Stephen Herek,Beth Grant,Dagmara Dominczyk,Matthew Glave,Drama Music,rock star,Stephen Herek Beth Grant Dagmara Dominczyk Matthew Glave Drama Music
Ridley Scott,Jeff Bridges,Jason Marsden,Ethan Embry,Adventure Drama,white squall,Ridley Scott Jeff Bridges Jason Marsden Ethan Embry Adventure Drama
John Carpenter,Wilford Brimley,Richard Masur,David Clennon,Horror Mystery Sci-Fi,the thing,John Carpenter Wilford Brimley Richard Masur David Clennon Horror Mystery Sci-Fi
David Twohy,Vin Diesel,Nolan Gerard Funk,Bokeem Woodbine,Action Sci-Fi Thriller,riddick,David Twohy Vin Diesel Nolan Gerard Funk Bokeem Woodbine Action Sci-Fi Thriller
Jeb Stuart,Gregory Scott Cummins,Claudia Stedelin,Ted Markland,Crime Mystery Thriller,switchback,Jeb Stuart Gregory Scott Cummins Claudia Stedelin Ted Markland Crime Mystery Thriller
Steve Miner,Tom Skerritt,Usher Raymond,Leonor Varela,Action Adventure Drama Thriller Western,texas rangers,Steve Miner Tom Skerritt Usher Raymond Leonor Varela Action Adventure Drama Thriller Western
Gil Kenan,Bill Murray,Toby Jones,Harry Treadaway,Adventure Family Fantasy Sci-Fi,city of ember,Gil Kenan Bill Murray Toby Jones Harry Treadaway Adventure Family Fantasy Sci-Fi
Paul Thomas Anderson,Mike Howard,Jeffrey W. Jenkins,Bruce Goodchild,Drama,the master,Paul Thomas Anderson Mike Howard Jeffrey W. Jenkins Bruce Goodchild Drama
David Leland,Hayden Christensen,Ryan Cartwright,David Walliams,Adventure Comedy History Romance,virgin territory,David Leland Hayden Christensen Ryan Cartwright David Walliams Adventure Comedy History Romance
Gary Fleder,Dennis Quaid,Nicole Beharie,Charles S. Dutton,Biography Drama Sport,the express,Gary Fleder Dennis Quaid Nicole Beharie Charles S. Dutton Biography Drama Sport
J Blakeson,Chloë Grace Moretz,Maggie Siff,Nick Robinson,Action Adventure Sci-Fi Thriller,the 5th wave,J Blakeson Chloë Grace Moretz Maggie Siff Nick Robinson Action Adventure Sci-Fi Thriller
Ryan Coogler,Sylvester Stallone,Phylicia Rashad,Graham McTavish,Drama Sport,creed,Ryan Coogler Sylvester Stallone Phylicia Rashad Graham McTavish Drama Sport
Ben Affleck,Jeremy Renner,Jon Hamm,Owen Burke,Crime Drama Thriller,the town,Ben Affleck Jeremy Renner Jon Hamm Owen Burke Crime Drama Thriller
Kirk Jones,Anna Kendrick,Dennis Quaid,Thomas Lennon,Comedy Drama Romance,what to expect when you're expecting,Kirk Jones Anna Kendrick Dennis Quaid Thomas Lennon Comedy Drama Romance
Ethan Coen,J.K. Simmons,Brad Pitt,Kevin Sussman,Comedy Drama,burn after reading,Ethan Coen J.K. Simmons Brad Pitt Kevin Sussman Comedy Drama
Jennifer Flackett,Gerard Butler,Anthony Simcoe,Christopher James Baker,Adventure Comedy Family Fantasy,nim's island,Jennifer Flackett Gerard Butler Anthony Simcoe Christopher James Baker Adventure Comedy Family Fantasy
Ron Howard,Chris Hemsworth,Olivia Wilde,Alexandra Maria Lara,Action Biography Drama Sport,rush,Ron Howard Chris Hemsworth Olivia Wilde Alexandra Maria Lara Action Biography Drama Sport
Paul Thomas Anderson,Patton Oswalt,Neil Flynn,Jim Meskimen,Drama,magnolia,Paul Thomas Anderson Patton Oswalt Neil Flynn Jim Meskimen Drama
Kevin Smith,Bruce Willis,Tracy Morgan,Kevin Pollak,Action Comedy Crime,cop out,Kevin Smith Bruce Willis Tracy Morgan Kevin Pollak Action Comedy Crime
Christian Ditter,Alison Brie,Damon Wayans Jr.,Nicholas Braun,Comedy Romance,how to be single,Christian Ditter Alison Brie Damon Wayans Jr. Nicholas Braun Comedy Romance
Charles Martin Smith,Morgan Freeman,Michael Roark,Harry Connick Jr.,Drama Family,dolphin tale,Charles Martin Smith Morgan Freeman Michael Roark Harry Connick Jr. Drama Family
Nick Cassavetes,Denzel Washington,Laura Harring,Anne Heche,Crime Drama Thriller,john q,Nick Cassavetes Denzel Washington Laura Harring Anne Heche Crime Drama Thriller
Les Mayfield,Peter Greene,Dave Chappelle,Tamala Jones,Action Comedy Crime Thriller,blue streak,Les Mayfield Peter Greene Dave Chappelle Tamala Jones Action Comedy Crime Thriller
Rawson Marshall Thurber,Laura-Leigh,Molly C. Quinn,Thomas Lennon,Comedy Crime,we're the millers,Rawson Marshall Thurber Laura-Leigh Molly C. Quinn Thomas Lennon Comedy Crime
Fedor Bondarchuk,Yuliya Snigir,Fedor Bondarchuk,Aleksey Serebryakov,Action Adventure Sci-Fi,obitaemyy ostrov,Fedor Bondarchuk Yuliya Snigir Fedor Bondarchuk Aleksey Serebryakov Action Adventure Sci-Fi
Jonathan Mostow,Kathleen Quinlan,M.C. Gainey,J.T. Walsh,Action Crime Drama Mystery Thriller,breakdown,Jonathan Mostow Kathleen Quinlan M.C. Gainey J.T. Walsh Action Crime Drama Mystery Thriller
Irvin Kershner,Bernie Casey,Klaus Maria Brandauer,Barbara Carrera,Action Adventure Thriller,never say never again,Irvin Kershner Bernie Casey Klaus Maria Brandauer Barbara Carrera Action Adventure Thriller
Steve Pink,Charlie McDermott,Collette Wolfe,Crystal Lowe,Comedy Sci-Fi,hot tub time machine,Steve Pink Charlie McDermott Collette Wolfe Crystal Lowe Comedy Sci-Fi
Charles Martin Smith,Morgan Freeman,Taylor Blackwell,Harry Connick Jr.,Drama Family,dolphin tale 2,Charles Martin Smith Morgan Freeman Taylor Blackwell Harry Connick Jr. Drama Family
John Frankenheimer,Charlize Theron,James Frain,Clarence Williams III,Action Adventure Crime Drama Family Fantasy Romance Thriller,reindeer games,John Frankenheimer Charlize Theron James Frain Clarence Williams III Action Adventure Crime Drama Family Fantasy Romance Thriller
F. Gary Gray,Vin Diesel,Jeff Kober,Larenz Tate,Action Crime Drama Thriller,a man apart,F. Gary Gray Vin Diesel Jeff Kober Larenz Tate Action Crime Drama Thriller
Rob Reiner,Alexa PenaVega,Virginia Madsen,Craig T. Nelson,Drama History,ghosts of mississippi,Rob Reiner Alexa PenaVega Virginia Madsen Craig T. Nelson Drama History
Scott Hicks,Rick Yune,Reeve Carney,Daniel von Bargen,Drama Mystery Romance Thriller,snow falling on cedars,Scott Hicks Rick Yune Reeve Carney Daniel von Bargen Drama Mystery Romance Thriller
Mikael Håfström,Anthony Hopkins,Colin O'Donoghue,Toby Jones,Drama Horror Mystery Thriller,the rite,Mikael Håfström Anthony Hopkins Colin O'Donoghue Toby Jones Drama Horror Mystery Thriller
Andrew Niccol,Blair Underwood,Xander Berkeley,Mason Gamble,Drama Sci-Fi Thriller,gattaca,Andrew Niccol Blair Underwood Xander Berkeley Mason Gamble Drama Sci-Fi Thriller
Andrew Bergman,Stockard Channing,Nathan Lane,John Larroquette,Biography Comedy Romance,isn't she great,Andrew Bergman Stockard Channing Nathan Lane John Larroquette Biography Comedy Romance
Kirk De Micco,Cheryl Hines,Kenan Thompson,Omid Abtahi,Adventure Animation Comedy Family Sci-Fi,space chimps,Kirk De Micco Cheryl Hines Kenan Thompson Omid Abtahi Adventure Animation Comedy Family Sci-Fi
Chris Rock,Bernie Mac,Dylan Baker,Tracy Morgan,Comedy,head of state,Chris Rock Bernie Mac Dylan Baker Tracy Morgan Comedy
Todd Phillips,Bradley Cooper,Rob Riggle,Mike Epps,Comedy,the hangover,Todd Phillips Bradley Cooper Rob Riggle Mike Epps Comedy
Wilson Yip,Mike Tyson,Lynn Hung,Kwok-Kwan Chan,Action Biography Drama History,ip man 3,Wilson Yip Mike Tyson Lynn Hung Kwok-Kwan Chan Action Biography Drama History
Jay Roach,Muse Watson,Verne Troyer,Robert Wagner,Action Adventure Comedy Crime,austin powers: the spy who shagged me,Jay Roach Muse Watson Verne Troyer Robert Wagner Action Adventure Comedy Crime
Tim Burton,Michael Gough,Jack Palance,William Hootkins,Action Adventure,batman,Tim Burton Michael Gough Jack Palance William Hootkins Action Adventure
Roland Joffé,Jordi Mollà,Dougray Scott,Lily Cole,Biography Drama War,there be dragons,Roland Joffé Jordi Mollà Dougray Scott Lily Cole Biography Drama War
Richard Donner,Rene Russo,Nick Chinlund,Stuart Wilson,Action Crime Thriller,lethal weapon 3,Richard Donner Rene Russo Nick Chinlund Stuart Wilson Action Crime Thriller
John Lee Hancock,Catherine Dyer,Quinton Aaron,Kim Dickens,Biography Drama Sport,the blind side,John Lee Hancock Catherine Dyer Quinton Aaron Kim Dickens Biography Drama Sport
Unknown,Jon Foo,Aimee Garcia,Wendie Malick,Action Comedy Crime,rush hour            ,Unknown Jon Foo Aimee Garcia Wendie Malick Action Comedy Crime
Robert Rodriguez,Alexa PenaVega,Cheech Marin,Daryl Sabara,Action Adventure Comedy Family Sci-Fi,spy kids,Robert Rodriguez Alexa PenaVega Cheech Marin Daryl Sabara Action Adventure Comedy Family Sci-Fi
Seth Gordon,Kevin Spacey,Lindsay Sloane,Reginald Ballard,Comedy Crime,horrible bosses,Seth Gordon Kevin Spacey Lindsay Sloane Reginald Ballard Comedy Crime
Ethan Coen,Matt Damon,Jeff Bridges,Bruce Green,Adventure Drama Western,true grit,Ethan Coen Matt Damon Jeff Bridges Bruce Green Adventure Drama Western
David Frankel,Meryl Streep,Anne Hathaway,Rebecca Mader,Comedy Drama Romance,the devil wears prada,David Frankel Meryl Streep Anne Hathaway Rebecca Mader Comedy Drama Romance
Robert Wise,Leonard Nimoy,Nichelle Nichols,Walter Koenig,Adventure Mystery Sci-Fi,star trek: the motion picture,Robert Wise Leonard Nimoy Nichelle Nichols Walter Koenig Adventure Mystery Sci-Fi
Seth Gordon,Jon Favreau,Eric Stonestreet,T.I.,Comedy Crime,identity thief,Seth Gordon Jon Favreau Eric Stonestreet T.I. Comedy Crime
Martin Scorsese,Robert De Niro,Robert Mitchum,Joe Don Baker,Crime Thriller,cape fear,Martin Scorsese Robert De Niro Robert Mitchum Joe Don Baker Crime Thriller
Robert Luketic,Kevin Spacey,Jim Sturgess,Josh Gad,Crime Drama Thriller,21,Robert Luketic Kevin Spacey Jim Sturgess Josh Gad Crime Drama Thriller
Judd Apatow,Amy Schumer,Randall Park,Josh Segarra,Comedy Romance,trainwreck,Judd Apatow Amy Schumer Randall Park Josh Segarra Comedy Romance
Kevin Rodney Sullivan,Bernie Mac,Nicole Sullivan,Sherri Shepherd,Comedy Romance,guess who,Kevin Rodney Sullivan Bernie Mac Nicole Sullivan Sherri Shepherd Comedy Romance
Anthony Minghella,Colin Firth,Kristin Scott Thomas,Jürgen Prochnow,Drama Romance War,the english patient,Anthony Minghella Colin Firth Kristin Scott Thomas Jürgen Prochnow Drama Romance War
Curtis Hanson,Kevin Spacey,Matt McCoy,Paul Guilfoyle,Crime Drama Mystery Thriller,l.a. confidential,Curtis Hanson Kevin Spacey Matt McCoy Paul Guilfoyle Crime Drama Mystery Thriller
Mike Mitchell,Michael Angarano,Kelly Preston,Nicholas Braun,Adventure Comedy Family Sci-Fi,sky high,Mike Mitchell Michael Angarano Kelly Preston Nicholas Braun Adventure Comedy Family Sci-Fi
Frank Oz,Tom Selleck,Wilford Brimley,Lauren Ambrose,Comedy,in & out,Frank Oz Tom Selleck Wilford Brimley Lauren Ambrose Comedy
Roger Donaldson,Natasha Henstridge,Marg Helgenberger,Jordan Lund,Action Horror Sci-Fi Thriller,species,Roger Donaldson Natasha Henstridge Marg Helgenberger Jordan Lund Action Horror Sci-Fi Thriller
Tarsem Singh,Dylan Baker,Jake Weber,James Gammon,Horror Sci-Fi Thriller,the cell,Tarsem Singh Dylan Baker Jake Weber James Gammon Horror Sci-Fi Thriller
Randall Wallace,Leonardo DiCaprio,Anne Parillaud,Judith Godrèche,Action Adventure,the man in the iron mask,Randall Wallace Leonardo DiCaprio Anne Parillaud Judith Godrèche Action Adventure
Randall Wallace,Scott Glenn,Kevin Connolly,Dylan Walsh,Biography Drama Family History Sport,secretariat,Randall Wallace Scott Glenn Kevin Connolly Dylan Walsh Biography Drama Family History Sport
Kevin Munroe,Chris Evans,Sarah Michelle Gellar,Mako,Action Adventure Animation Comedy Family Fantasy Sci-Fi,tmnt,Kevin Munroe Chris Evans Sarah Michelle Gellar Mako Action Adventure Animation Comedy Family Fantasy Sci-Fi
Michael Tollin,Alfre Woodard,Riley Smith,Debra Winger,Biography Drama Sport,radio,Michael Tollin Alfre Woodard Riley Smith Debra Winger Biography Drama Sport
Will Gluck,Mila Kunis,Justin Timberlake,Masi Oka,Comedy Romance,friends with benefits,Will Gluck Mila Kunis Justin Timberlake Masi Oka Comedy Romance
Nicholas Stoller,Chloë Grace Moretz,Ike Barinholtz,Kiersey Clemons,Comedy,neighbors 2: sorority rising,Nicholas Stoller Chloë Grace Moretz Ike Barinholtz Kiersey Clemons Comedy
John Lee Hancock,Tom Hanks,Ruth Wilson,B.J. Novak,Biography Comedy Drama History Music,saving mr. banks,John Lee Hancock Tom Hanks Ruth Wilson B.J. Novak Biography Comedy Drama History Music
Spike Lee,Denzel Washington,Delroy Lindo,Al Freeman Jr.,Biography Drama History Romance,malcolm x,Spike Lee Denzel Washington Delroy Lindo Al Freeman Jr. Biography Drama History Romance
Judd Apatow,Charlyne Yi,Maude Apatow,Mackenzie Aladjem,Comedy,this is 40,Judd Apatow Charlyne Yi Maude Apatow Mackenzie Aladjem Comedy
Walt Becker,Robin Williams,Bernie Mac,Ann-Margret,Comedy Family,old dogs,Walt Becker Robin Williams Bernie Mac Ann-Margret Comedy Family
Patrick Tatopoulos,Craig Parker,Kevin Grevioux,Steven Mackintosh,Action Adventure Fantasy Sci-Fi Thriller,underworld: rise of the lycans,Patrick Tatopoulos Craig Parker Kevin Grevioux Steven Mackintosh Action Adventure Fantasy Sci-Fi Thriller
Ken Kwapis,Robin Williams,Christine Taylor,Mindy Kaling,Comedy Romance,license to wed,Ken Kwapis Robin Williams Christine Taylor Mindy Kaling Comedy Romance
Dennis Dugan,Jon Lovitz,Jon Heder,Tim Meadows,Comedy Romance Sport,the benchwarmers,Dennis Dugan Jon Lovitz Jon Heder Tim Meadows Comedy Romance Sport
Gary David Goldberg,Stockard Channing,Victor Webster,Elizabeth Perkins,Comedy Romance,must love dogs,Gary David Goldberg Stockard Channing Victor Webster Elizabeth Perkins Comedy Romance
Mike Newell,Johnny Depp,Al Pacino,Anne Heche,Biography Crime Drama,donnie brasco,Mike Newell Johnny Depp Al Pacino Anne Heche Biography Crime Drama
Paul W.S. Anderson,Milla Jovovich,Jaymes Butler,Colin Salmon,Action Horror Sci-Fi,resident evil,Paul W.S. Anderson Milla Jovovich Jaymes Butler Colin Salmon Action Horror Sci-Fi
Ethan Coen,J.K. Simmons,Tom Hanks,Stephen Root,Comedy Crime Thriller,the ladykillers,Ethan Coen J.K. Simmons Tom Hanks Stephen Root Comedy Crime Thriller
John Moore,Mila Kunis,Beau Bridges,Jamie Hector,Action Crime Drama Mystery Thriller,max payne,John Moore Mila Kunis Beau Bridges Jamie Hector Action Crime Drama Mystery Thriller
Andrew Niccol,Matt Bomer,Olivia Wilde,Justin Timberlake,Action Sci-Fi Thriller,in time,Andrew Niccol Matt Bomer Olivia Wilde Justin Timberlake Action Sci-Fi Thriller
Alan Poul,Danneel Ackles,Noureen DeWulf,Tom Bosley,Comedy Romance,the back-up plan,Alan Poul Danneel Ackles Noureen DeWulf Tom Bosley Comedy Romance
Luke Greenfield,Ashley Williams,Steve Howey,Kirsten Day,Comedy Drama Romance,something borrowed,Luke Greenfield Ashley Williams Steve Howey Kirsten Day Comedy Drama Romance
Unknown,Jodi Lyn O'Keefe,Kimberly Elise,Logan Browning,Drama Romance,hit the floor            ,Unknown Jodi Lyn O'Keefe Kimberly Elise Logan Browning Drama Romance
Gil Junger,Tom Wilkinson,Marsha Thomason,Vincent Regan,Adventure Comedy Fantasy,black knight,Gil Junger Tom Wilkinson Marsha Thomason Vincent Regan Adventure Comedy Fantasy
Michael Ritchie,Tatum O'Neal,Vic Morrow,Joyce Van Patten,Comedy Drama Family Sport,the bad news bears,Michael Ritchie Tatum O'Neal Vic Morrow Joyce Van Patten Comedy Drama Family Sport
Steven E. de Souza,Ming-Na Wen,Raul Julia,Kylie Minogue,Action Adventure Comedy Thriller,street fighter,Steven E. de Souza Ming-Na Wen Raul Julia Kylie Minogue Action Adventure Comedy Thriller
Roman Polanski,Emilia Fox,Frank Finlay,Ed Stoppard,Biography Drama War,the pianist,Roman Polanski Emilia Fox Frank Finlay Ed Stoppard Biography Drama War
Albert Hughes,Johnny Depp,Jason Flemyng,Ian Richardson,Horror Mystery Thriller,from hell,Albert Hughes Johnny Depp Jason Flemyng Ian Richardson Horror Mystery Thriller
Catherine Hardwicke,Keisha Castle-Hughes,Hiam Abbass,Shaun Toub,Drama Family Fantasy,the nativity story,Catherine Hardwicke Keisha Castle-Hughes Hiam Abbass Shaun Toub Drama Family Fantasy
Mike Nichols,Natalie Portman,Julia Roberts,Colin Stinton,Drama Romance,closer,Mike Nichols Natalie Portman Julia Roberts Colin Stinton Drama Romance
Clint Eastwood,Leonardo DiCaprio,Naomi Watts,Kaitlyn Dever,Biography Crime Drama,j. edgar,Clint Eastwood Leonardo DiCaprio Naomi Watts Kaitlyn Dever Biography Crime Drama
Alexandre Aja,Jason Flemyng,Cameron Boyce,Julian Glover,Horror Mystery,mirrors,Alexandre Aja Jason Flemyng Cameron Boyce Julian Glover Horror Mystery
Michael Rymer,Aaliyah,Lena Olin,Bruce Spence,Drama Fantasy Horror,queen of the damned,Michael Rymer Aaliyah Lena Olin Bruce Spence Drama Fantasy Horror
Stephen Hopkins,Adam Baldwin,Robert Davi,Kevin Peter Hall,Action Horror Sci-Fi,predator 2,Stephen Hopkins Adam Baldwin Robert Davi Kevin Peter Hall Action Horror Sci-Fi
Gregory Hoblit,Billy Burke,Jesse Tyler Ferguson,Joseph Cross,Crime Drama Thriller,untraceable,Gregory Hoblit Billy Burke Jesse Tyler Ferguson Joseph Cross Crime Drama Thriller
Hugh Wilson,Brendan Fraser,Sissy Spacek,Douglas Smith,Comedy Drama Romance Sci-Fi,blast from the past,Hugh Wilson Brendan Fraser Sissy Spacek Douglas Smith Comedy Drama Romance Sci-Fi
Mike Hodges,Brian Blessed,William Hootkins,Sam J. Jones,Action Adventure Sci-Fi,flash gordon,Mike Hodges Brian Blessed William Hootkins Sam J. Jones Action Adventure Sci-Fi
Kevin Smith,Stephen Root,Mike Starr,George Carlin,Comedy Drama Romance,jersey girl,Kevin Smith Stephen Root Mike Starr George Carlin Comedy Drama Romance
Rob Cohen,Cicely Tyson,Chad Lindberg,Carmen Ejogo,Action Crime Mystery Thriller,alex cross,Rob Cohen Cicely Tyson Chad Lindberg Carmen Ejogo Action Crime Mystery Thriller
Clint Eastwood,Kevin Spacey,Bob Gunton,Leon Rippy,Crime Drama Mystery Thriller,midnight in the garden of good and evil,Clint Eastwood Kevin Spacey Bob Gunton Leon Rippy Crime Drama Mystery Thriller
Susanna White,Daniel Mays,Bill Bailey,Eros Vlahos,Comedy Family Fantasy,nanny mcphee returns,Susanna White Daniel Mays Bill Bailey Eros Vlahos Comedy Family Fantasy
Danny DeVito,Frank Whaley,J.T. Walsh,Paul Guilfoyle,Biography Crime Drama,hoffa,Danny DeVito Frank Whaley J.T. Walsh Paul Guilfoyle Biography Crime Drama
Chris Carter,Mitch Pileggi,Callum Rennie,Nicki Aycox,Drama Mystery Sci-Fi Thriller,the x files: i want to believe,Chris Carter Mitch Pileggi Callum Rennie Nicki Aycox Drama Mystery Sci-Fi Thriller
Tommy O'Haver,Anne Hathaway,Steve Coogan,Joanna Lumley,Comedy Family Fantasy Romance,ella enchanted,Tommy O'Haver Anne Hathaway Steve Coogan Joanna Lumley Comedy Family Fantasy Romance
Peter Landesman,Will Smith,Eddie Marsan,Albert Brooks,Biography Drama Sport,concussion,Peter Landesman Will Smith Eddie Marsan Albert Brooks Biography Drama Sport
Gary Chapman,Jim Broadbent,Olivia Williams,Pip Torrens,Adventure Animation Comedy Family War,valiant,Gary Chapman Jim Broadbent Olivia Williams Pip Torrens Adventure Animation Comedy Family War
Curtis Hanson,Robert Downey Jr.,Rip Torn,Richard Thomas,Comedy Drama,wonder boys,Curtis Hanson Robert Downey Jr. Rip Torn Richard Thomas Comedy Drama
Craig Mazin,Drake Bell,Tracy Morgan,Marion Ross,Action Comedy Sci-Fi Thriller,superhero movie,Craig Mazin Drake Bell Tracy Morgan Marion Ross Action Comedy Sci-Fi Thriller
Allen Hughes,Alona Tal,James Ransone,Michael Beach,Crime Drama Thriller,broken city,Allen Hughes Alona Tal James Ransone Michael Beach Crime Drama Thriller
Wes Craven,Shannon Elizabeth,Portia de Rossi,Derek Mears,Comedy Horror,cursed,Wes Craven Shannon Elizabeth Portia de Rossi Derek Mears Comedy Horror
David Koepp,Joseph Gordon-Levitt,Dania Ramirez,Aasif Mandvi,Action Crime Thriller,premium rush,David Koepp Joseph Gordon-Levitt Dania Ramirez Aasif Mandvi Action Crime Thriller
Anne Fletcher,Jim Gaffigan,Richard T. Jones,Michael Mosley,Action Comedy Crime,hot pursuit,Anne Fletcher Jim Gaffigan Richard T. Jones Michael Mosley Action Comedy Crime
Shekhar Kapur,Djimon Hounsou,Lucy Gordon,Alex Jennings,Adventure Drama Romance War,the four feathers,Shekhar Kapur Djimon Hounsou Lucy Gordon Alex Jennings Adventure Drama Romance War
Taylor Hackford,Jason Statham,Clifton Collins Jr.,Wendell Pierce,Action Crime Romance Thriller,parker,Taylor Hackford Jason Statham Clifton Collins Jr. Wendell Pierce Action Crime Romance Thriller
Richard Loncraine,Kirsten Dunst,Jon Favreau,Austin Nichols,Comedy Romance Sport,wimbledon,Richard Loncraine Kirsten Dunst Jon Favreau Austin Nichols Comedy Romance Sport
Roger Kumble,Brendan Fraser,Brooke Shields,Matt Prokop,Comedy Family,furry vengeance,Roger Kumble Brendan Fraser Brooke Shields Matt Prokop Comedy Family
Kimble Rendall,Alex Russell,Cariba Heine,Richard Brancatisano,Action Horror Sci-Fi,bait,Kimble Rendall Alex Russell Cariba Heine Richard Brancatisano Action Horror Sci-Fi
Peter Yates,Liam Neeson,Alun Armstrong,Lysette Anthony,Action Adventure Fantasy,krull,Peter Yates Liam Neeson Alun Armstrong Lysette Anthony Action Adventure Fantasy
Robert Redford,Meryl Streep,Tom Cruise,Andrew Garfield,Drama Thriller War,lions for lambs,Robert Redford Meryl Streep Tom Cruise Andrew Garfield Drama Thriller War
John Milius,Rosanna Arquette,Dann Florek,Christopher Rich,Action Drama Thriller War,flight of the intruder,John Milius Rosanna Arquette Dann Florek Christopher Rich Action Drama Thriller War
Jake Kasdan,Tim Meadows,Nat Faxon,Matt Price,Comedy Music,walk hard: the dewey cox story,Jake Kasdan Tim Meadows Nat Faxon Matt Price Comedy Music
Lasse Hallström,Kevin Spacey,Scott Glenn,Jason Behr,Drama,the shipping news,Lasse Hallström Kevin Spacey Scott Glenn Jason Behr Drama
Les Mayfield,Gregory Smith,Ronny Cox,Harris Yulin,Action Western,american outlaws,Les Mayfield Gregory Smith Ronny Cox Harris Yulin Action Western
Jean-Marc Vallée,Michiel Huisman,Jim Broadbent,Thomas Kretschmann,Biography Drama History Romance,the young victoria,Jean-Marc Vallée Michiel Huisman Jim Broadbent Thomas Kretschmann Biography Drama History Romance
Dominic Sena,Tom Skerritt,Bashar Rahal,Shawn Doyle,Action Crime Mystery Thriller,whiteout,Dominic Sena Tom Skerritt Bashar Rahal Shawn Doyle Action Crime Mystery Thriller
Terrence Malick,Brad Pitt,Tye Sheridan,Fiona Shaw,Drama Fantasy,the tree of life,Terrence Malick Brad Pitt Tye Sheridan Fiona Shaw Drama Fantasy
Hark Tsui,Paul Sorvino,Lela Rochon,Ray Nicholas,Action Comedy Thriller,knock off,Hark Tsui Paul Sorvino Lela Rochon Ray Nicholas Action Comedy Thriller
