director_name,actor_1_name,actor_2_name,actor_3_name,genres,movie_title,comb
James Cameron,CCH Pounder,Joel David Moore,Wes Studi,Action Adventure Fantasy Sci-Fi,avatar,James Cameron CCH Pounder Joel David Moore Wes Studi Action Adventure Fantasy Sci-Fi
Gore Verbinski,Johnny Depp,Orlando Bloom,Jack Davenport,Action Adventure Fantasy,pirates of the caribbean: at world's end,Gore Verbinski Johnny Depp Orlando Bloom Jack Davenport Action Adventure Fantasy
Sam Mendes,Christoph Waltz,Rory Kinnear,Stephanie Sigman,Action Adventure Thriller,spectre,Sam Mendes Christoph Waltz Rory Kinnear Stephanie Sigman Action Adventure Thriller
Christopher Nolan,Tom Hardy,Christian Bale,Joseph Gordon-Levitt,Action Thriller,the dark knight rises,Christopher Nolan Tom Hardy Christian Bale Joseph Gordon-Levitt Action Thriller
Doug Walker,Doug Walker,Rob Walker,Unknown,Documentary,star wars: episode vii - the force awakens            ,Doug Walker Doug Walker Rob Walker Unknown Documentary
Andrew Stanton,Daryl Sabara,Samantha Morton,Polly Walker,Action Adventure Sci-Fi,john carter,Andrew Stanton Daryl Sabara Samantha Morton Polly Walker Action Adventure Sci-Fi
Nathan Greno,Brad Garrett,Donna Murphy,M.C. Gainey,Adventure Animation Comedy Family Fantasy Musical Romance,tangled,Nathan Greno Brad Garrett Donna Murphy M.C. Gainey Adventure Animation Comedy Family Fantasy Musical Romance
Joss Whedon,Chris Hemsworth,Robert Downey Jr.,Scarlett Johansson,Action Adventure Sci-Fi,avengers: age of ultron,Joss Whedon Chris Hemsworth Robert Downey Jr. Scarlett Johansson Action Adventure Sci-Fi
David Yates,Alan Rickman,Daniel Radcliffe,Rupert Grint,Adventure Family Fantasy Mystery,harry potter and the half-blood prince,David Yates Alan Rickman Daniel Radcliffe Rupert Grint Adventure Family Fantasy Mystery
Zack Snyder,Henry Cavill,Lauren Cohan,Alan D. Purwin,Action Adventure Sci-Fi,batman v superman: dawn of justice,Zack Snyder Henry Cavill Lauren Cohan Alan D. Purwin Action Adventure Sci-Fi
Bryan Singer,Kevin Spacey,Marlon Brando,Frank Langella,Action Adventure Sci-Fi,superman returns,Bryan Singer Kevin Spacey Marlon Brando Frank Langella Action Adventure Sci-Fi
Marc Forster,Giancarlo Giannini,Mathieu Amalric,Rory Kinnear,Action Adventure,quantum of solace,Marc Forster Giancarlo Giannini Mathieu Amalric Rory Kinnear Action Adventure
Gore Verbinski,Johnny Depp,Orlando Bloom,Jack Davenport,Action Adventure Fantasy,pirates of the caribbean: dead man's chest,Gore Verbinski Johnny Depp Orlando Bloom Jack Davenport Action Adventure Fantasy
Gore Verbinski,Johnny Depp,Ruth Wilson,Tom Wilkinson,Action Adventure Western,the lone ranger,Gore Verbinski Johnny Depp Ruth Wilson Tom Wilkinson Action Adventure Western
Zack Snyder,Henry Cavill,Christopher Meloni,Harry Lennix,Action Adventure Fantasy Sci-Fi,man of steel,Zack Snyder Henry Cavill Christopher Meloni Harry Lennix Action Adventure Fantasy Sci-Fi
Andrew Adamson,Peter Dinklage,Pierfrancesco Favino,Damián Alcázar,Action Adventure Family Fantasy,the chronicles of narnia: prince caspian,Andrew Adamson Peter Dinklage Pierfrancesco Favino Damián Alcázar Action Adventure Family Fantasy
Rob Marshall,Johnny Depp,Sam Claflin,Stephen Graham,Action Adventure Fantasy,pirates of the caribbean: on stranger tides,Rob Marshall Johnny Depp Sam Claflin Stephen Graham Action Adventure Fantasy
Barry Sonnenfeld,Will Smith,Michael Stuhlbarg,Nicole Scherzinger,Action Adventure Comedy Family Fantasy Sci-Fi,men in black 3,Barry Sonnenfeld Will Smith Michael Stuhlbarg Nicole Scherzinger Action Adventure Comedy Family Fantasy Sci-Fi
Peter Jackson,Aidan Turner,Adam Brown,James Nesbitt,Adventure Fantasy,the hobbit: the battle of the five armies,Peter Jackson Aidan Turner Adam Brown James Nesbitt Adventure Fantasy
Marc Webb,Emma Stone,Andrew Garfield,Chris Zylka,Action Adventure Fantasy,the amazing spider-man,Marc Webb Emma Stone Andrew Garfield Chris Zylka Action Adventure Fantasy
Ridley Scott,Mark Addy,William Hurt,Scott Grimes,Action Adventure Drama History,robin hood,Ridley Scott Mark Addy William Hurt Scott Grimes Action Adventure Drama History
Peter Jackson,Aidan Turner,Adam Brown,James Nesbitt,Adventure Fantasy,the hobbit: the desolation of smaug,Peter Jackson Aidan Turner Adam Brown James Nesbitt Adventure Fantasy
Chris Weitz,Christopher Lee,Eva Green,Kristin Scott Thomas,Adventure Family Fantasy,the golden compass,Chris Weitz Christopher Lee Eva Green Kristin Scott Thomas Adventure Family Fantasy
James Cameron,Leonardo DiCaprio,Kate Winslet,Gloria Stuart,Drama Romance,titanic,James Cameron Leonardo DiCaprio Kate Winslet Gloria Stuart Drama Romance
Anthony Russo,Robert Downey Jr.,Scarlett Johansson,Chris Evans,Action Adventure Sci-Fi,captain america: civil war,Anthony Russo Robert Downey Jr. Scarlett Johansson Chris Evans Action Adventure Sci-Fi
Peter Berg,Liam Neeson,Alexander Skarsgård,Tadanobu Asano,Action Adventure Sci-Fi Thriller,battleship,Peter Berg Liam Neeson Alexander Skarsgård Tadanobu Asano Action Adventure Sci-Fi Thriller
Colin Trevorrow,Bryce Dallas Howard,Judy Greer,Omar Sy,Action Adventure Sci-Fi Thriller,jurassic world,Colin Trevorrow Bryce Dallas Howard Judy Greer Omar Sy Action Adventure Sci-Fi Thriller
Sam Raimi,J.K. Simmons,James Franco,Kirsten Dunst,Action Adventure Fantasy Romance,spider-man 2,Sam Raimi J.K. Simmons James Franco Kirsten Dunst Action Adventure Fantasy Romance
Shane Black,Robert Downey Jr.,Jon Favreau,Don Cheadle,Action Adventure Sci-Fi,iron man 3,Shane Black Robert Downey Jr. Jon Favreau Don Cheadle Action Adventure Sci-Fi
Brett Ratner,Hugh Jackman,Kelsey Grammer,Daniel Cudmore,Action Adventure Fantasy Sci-Fi Thriller,x-men: the last stand,Brett Ratner Hugh Jackman Kelsey Grammer Daniel Cudmore Action Adventure Fantasy Sci-Fi Thriller
Dan Scanlon,Steve Buscemi,Tyler Labine,Sean Hayes,Adventure Animation Comedy Family Fantasy,monsters university,Dan Scanlon Steve Buscemi Tyler Labine Sean Hayes Adventure Animation Comedy Family Fantasy
Michael Bay,Glenn Morshower,Kevin Dunn,Ramon Rodriguez,Action Adventure Sci-Fi,transformers: revenge of the fallen,Michael Bay Glenn Morshower Kevin Dunn Ramon Rodriguez Action Adventure Sci-Fi
Michael Bay,Bingbing Li,Sophia Myles,Kelsey Grammer,Action Adventure Sci-Fi,transformers: age of extinction,Michael Bay Bingbing Li Sophia Myles Kelsey Grammer Action Adventure Sci-Fi
Marc Webb,Emma Stone,Andrew Garfield,B.J. Novak,Action Adventure Fantasy Sci-Fi,the amazing spider-man 2,Marc Webb Emma Stone Andrew Garfield B.J. Novak Action Adventure Fantasy Sci-Fi
John Lasseter,Joe Mantegna,Thomas Kretschmann,Eddie Izzard,Adventure Animation Comedy Family Sport,cars 2,John Lasseter Joe Mantegna Thomas Kretschmann Eddie Izzard Adventure Animation Comedy Family Sport
Martin Campbell,Ryan Reynolds,Temuera Morrison,Taika Waititi,Action Adventure Sci-Fi,green lantern,Martin Campbell Ryan Reynolds Temuera Morrison Taika Waititi Action Adventure Sci-Fi
Lee Unkrich,Tom Hanks,John Ratzenberger,Don Rickles,Adventure Animation Comedy Family Fantasy,toy story 3,Lee Unkrich Tom Hanks John Ratzenberger Don Rickles Adventure Animation Comedy Family Fantasy
McG,Christian Bale,Bryce Dallas Howard,Common,Action Adventure Sci-Fi,terminator salvation,McG Christian Bale Bryce Dallas Howard Common Action Adventure Sci-Fi
James Wan,Jason Statham,Paul Walker,Vin Diesel,Action Crime Thriller,furious 7,James Wan Jason Statham Paul Walker Vin Diesel Action Crime Thriller
Marc Forster,Peter Capaldi,Brad Pitt,Mireille Enos,Action Adventure Horror Sci-Fi Thriller,world war z,Marc Forster Peter Capaldi Brad Pitt Mireille Enos Action Adventure Horror Sci-Fi Thriller
Bryan Singer,Jennifer Lawrence,Peter Dinklage,Hugh Jackman,Action Adventure Fantasy Sci-Fi Thriller,x-men: days of future past,Bryan Singer Jennifer Lawrence Peter Dinklage Hugh Jackman Action Adventure Fantasy Sci-Fi Thriller
J.J. Abrams,Benedict Cumberbatch,Bruce Greenwood,Noel Clarke,Action Adventure Sci-Fi,star trek into darkness,J.J. Abrams Benedict Cumberbatch Bruce Greenwood Noel Clarke Action Adventure Sci-Fi
Bryan Singer,Eddie Marsan,Ewen Bremner,Ralph Brown,Adventure Fantasy,jack the giant slayer,Bryan Singer Eddie Marsan Ewen Bremner Ralph Brown Adventure Fantasy
Mike Newell,Jake Gyllenhaal,Richard Coyle,Reece Ritchie,Action Adventure Fantasy Romance,prince of persia: the sands of time,Mike Newell Jake Gyllenhaal Richard Coyle Reece Ritchie Action Adventure Fantasy Romance
Guillermo del Toro,Charlie Hunnam,Clifton Collins Jr.,Larry Joe Campbell,Action Adventure Sci-Fi,pacific rim,Guillermo del Toro Charlie Hunnam Clifton Collins Jr. Larry Joe Campbell Action Adventure Sci-Fi
Michael Bay,Glenn Morshower,Lester Speight,Kevin Dunn,Action Adventure Sci-Fi,transformers: dark of the moon,Michael Bay Glenn Morshower Lester Speight Kevin Dunn Action Adventure Sci-Fi
Steven Spielberg,Harrison Ford,Ray Winstone,Jim Broadbent,Action Adventure Fantasy,indiana jones and the kingdom of the crystal skull,Steven Spielberg Harrison Ford Ray Winstone Jim Broadbent Action Adventure Fantasy
Peter Sohn,A.J. Buckley,Jack McGraw,Peter Sohn,Adventure Animation Comedy Family Fantasy,the good dinosaur,Peter Sohn A.J. Buckley Jack McGraw Peter Sohn Adventure Animation Comedy Family Fantasy
Mark Andrews,Kelly Macdonald,John Ratzenberger,Julie Walters,Adventure Animation Comedy Family Fantasy,brave,Mark Andrews Kelly Macdonald John Ratzenberger Julie Walters Adventure Animation Comedy Family Fantasy
Justin Lin,Sofia Boutella,Melissa Roxburgh,Lydia Wilson,Action Adventure Sci-Fi Thriller,star trek beyond,Justin Lin Sofia Boutella Melissa Roxburgh Lydia Wilson Action Adventure Sci-Fi Thriller
Andrew Stanton,John Ratzenberger,Fred Willard,Jeff Garlin,Adventure Animation Family Sci-Fi,wall·e,Andrew Stanton John Ratzenberger Fred Willard Jeff Garlin Adventure Animation Family Sci-Fi
Brett Ratner,Tzi Ma,Dana Ivey,Noémie Lenoir,Action Comedy Crime Thriller,rush hour 3,Brett Ratner Tzi Ma Dana Ivey Noémie Lenoir Action Comedy Crime Thriller
Roland Emmerich,Oliver Platt,Liam James,Tom McCarthy,Action Adventure Sci-Fi,2012,Roland Emmerich Oliver Platt Liam James Tom McCarthy Action Adventure Sci-Fi
Robert Zemeckis,Robin Wright,Colin Firth,Gary Oldman,Animation Drama Family Fantasy,a christmas carol,Robert Zemeckis Robin Wright Colin Firth Gary Oldman Animation Drama Family Fantasy
Lana Wachowski,Channing Tatum,Mila Kunis,Eddie Redmayne,Action Adventure Sci-Fi,jupiter ascending,Lana Wachowski Channing Tatum Mila Kunis Eddie Redmayne Action Adventure Sci-Fi
Andrew Adamson,Jim Broadbent,Kiran Shah,Shane Rangi,Adventure Family Fantasy,"the chronicles of narnia: the lion, the witch and the wardrobe",Andrew Adamson Jim Broadbent Kiran Shah Shane Rangi Adventure Family Fantasy
Bryan Singer,Jennifer Lawrence,Michael Fassbender,Tye Sheridan,Action Adventure Sci-Fi,x-men: apocalypse,Bryan Singer Jennifer Lawrence Michael Fassbender Tye Sheridan Action Adventure Sci-Fi
Christopher Nolan,Christian Bale,Heath Ledger,Morgan Freeman,Action Crime Drama Thriller,the dark knight,Christopher Nolan Christian Bale Heath Ledger Morgan Freeman Action Crime Drama Thriller
Pete Docter,John Ratzenberger,Delroy Lindo,Jess Harnell,Adventure Animation Comedy Family,up,Pete Docter John Ratzenberger Delroy Lindo Jess Harnell Adventure Animation Comedy Family
Rob Letterman,Amy Poehler,Rainn Wilson,Stephen Colbert,Action Adventure Animation Comedy Family Sci-Fi,monsters vs. aliens,Rob Letterman Amy Poehler Rainn Wilson Stephen Colbert Action Adventure Animation Comedy Family Sci-Fi
Jon Favreau,Robert Downey Jr.,Jeff Bridges,Jon Favreau,Action Adventure Sci-Fi,iron man,Jon Favreau Robert Downey Jr. Jeff Bridges Jon Favreau Action Adventure Sci-Fi
Martin Scorsese,Chloë Grace Moretz,Christopher Lee,Ray Winstone,Adventure Drama Family Mystery,hugo,Martin Scorsese Chloë Grace Moretz Christopher Lee Ray Winstone Adventure Drama Family Mystery
Barry Sonnenfeld,Will Smith,Salma Hayek,Bai Ling,Action Comedy Sci-Fi Western,wild wild west,Barry Sonnenfeld Will Smith Salma Hayek Bai Ling Action Comedy Sci-Fi Western
Rob Cohen,Jet Li,Brendan Fraser,Russell Wong,Action Adventure Fantasy Horror Thriller,the mummy: tomb of the dragon emperor,Rob Cohen Jet Li Brendan Fraser Russell Wong Action Adventure Fantasy Horror Thriller
David Ayer,Will Smith,Robin Atkin Downes,Ike Barinholtz,Action Adventure Comedy Sci-Fi,suicide squad,David Ayer Will Smith Robin Atkin Downes Ike Barinholtz Action Adventure Comedy Sci-Fi
Tom Shadyac,Jimmy Bennett,Morgan Freeman,Steve Carell,Comedy Family Fantasy,evan almighty,Tom Shadyac Jimmy Bennett Morgan Freeman Steve Carell Comedy Family Fantasy
Doug Liman,Tom Cruise,Lara Pulver,Noah Taylor,Action Adventure Sci-Fi,edge of tomorrow,Doug Liman Tom Cruise Lara Pulver Noah Taylor Action Adventure Sci-Fi
Kevin Reynolds,Jeanne Tripplehorn,Rick Aviles,Zakes Mokae,Action Adventure Sci-Fi Thriller,waterworld,Kevin Reynolds Jeanne Tripplehorn Rick Aviles Zakes Mokae Action Adventure Sci-Fi Thriller
Stephen Sommers,Joseph Gordon-Levitt,Dennis Quaid,Leo Howard,Action Adventure Sci-Fi Thriller,g.i. joe: the rise of cobra,Stephen Sommers Joseph Gordon-Levitt Dennis Quaid Leo Howard Action Adventure Sci-Fi Thriller
Pete Docter,Amy Poehler,Mindy Kaling,Phyllis Smith,Adventure Animation Comedy Drama Family Fantasy,inside out,Pete Docter Amy Poehler Mindy Kaling Phyllis Smith Adventure Animation Comedy Drama Family Fantasy
Jon Favreau,Robert Downey Jr.,Scarlett Johansson,Jon Favreau,Action Adventure Sci-Fi,iron man 2,Jon Favreau Robert Downey Jr. Scarlett Johansson Jon Favreau Action Adventure Sci-Fi
Rupert Sanders,Chris Hemsworth,Kristen Stewart,Sam Claflin,Action Adventure Drama Fantasy,snow white and the huntsman,Rupert Sanders Chris Hemsworth Kristen Stewart Sam Claflin Action Adventure Drama Fantasy
Robert Stromberg,Angelina Jolie Pitt,Sharlto Copley,Sam Riley,Action Adventure Family Fantasy Romance,maleficent,Robert Stromberg Angelina Jolie Pitt Sharlto Copley Sam Riley Action Adventure Family Fantasy Romance
Matt Reeves,Gary Oldman,Judy Greer,Kodi Smit-McPhee,Action Adventure Drama Sci-Fi,dawn of the planet of the apes,Matt Reeves Gary Oldman Judy Greer Kodi Smit-McPhee Action Adventure Drama Sci-Fi
Carl Rinsch,Keanu Reeves,Cary-Hiroyuki Tagawa,Jin Akanishi,Action Adventure Drama Fantasy,47 ronin,Carl Rinsch Keanu Reeves Cary-Hiroyuki Tagawa Jin Akanishi Action Adventure Drama Fantasy
Anthony Russo,Scarlett Johansson,Chris Evans,Hayley Atwell,Action Adventure Sci-Fi,captain america: the winter soldier,Anthony Russo Scarlett Johansson Chris Evans Hayley Atwell Action Adventure Sci-Fi
Mike Mitchell,Jon Hamm,Kathy Griffin,Mary Kay Place,Adventure Animation Comedy Family Fantasy,shrek forever after,Mike Mitchell Jon Hamm Kathy Griffin Mary Kay Place Adventure Animation Comedy Family Fantasy
Brad Bird,Judy Greer,Chris Bauer,Thomas Robinson,Action Adventure Family Mystery Sci-Fi,tomorrowland,Brad Bird Judy Greer Chris Bauer Thomas Robinson Action Adventure Family Mystery Sci-Fi
Don Hall,Damon Wayans Jr.,Daniel Henney,Abraham Benrubi,Action Adventure Animation Comedy Drama Family Sci-Fi,big hero 6,Don Hall Damon Wayans Jr. Daniel Henney Abraham Benrubi Action Adventure Animation Comedy Drama Family Sci-Fi
Rich Moore,Jack McBrayer,Sarah Silverman,Joe Lo Truglio,Adventure Animation Comedy Family Sci-Fi,wreck-it ralph,Rich Moore Jack McBrayer Sarah Silverman Joe Lo Truglio Adventure Animation Comedy Family Sci-Fi
Robert Zemeckis,Tom Hanks,Eddie Deezen,Peter Scolari,Adventure Animation Family Fantasy,the polar express,Robert Zemeckis Tom Hanks Eddie Deezen Peter Scolari Adventure Animation Family Fantasy
Roland Emmerich,Vivica A. Fox,Sela Ward,Judd Hirsch,Action Adventure Sci-Fi,independence day: resurgence,Roland Emmerich Vivica A. Fox Sela Ward Judd Hirsch Action Adventure Sci-Fi
Dean DeBlois,Gerard Butler,America Ferrera,Craig Ferguson,Adventure Animation Family Fantasy,how to train your dragon,Dean DeBlois Gerard Butler America Ferrera Craig Ferguson Adventure Animation Family Fantasy
Jonathan Mostow,Nick Stahl,M.C. Gainey,Carolyn Hennesy,Action Sci-Fi,terminator 3: rise of the machines,Jonathan Mostow Nick Stahl M.C. Gainey Carolyn Hennesy Action Sci-Fi
James Gunn,Bradley Cooper,Vin Diesel,Djimon Hounsou,Action Adventure Sci-Fi,guardians of the galaxy,James Gunn Bradley Cooper Vin Diesel Djimon Hounsou Action Adventure Sci-Fi
Christopher Nolan,Matthew McConaughey,Anne Hathaway,Mackenzie Foy,Adventure Drama Sci-Fi,interstellar,Christopher Nolan Matthew McConaughey Anne Hathaway Mackenzie Foy Adventure Drama Sci-Fi
Christopher Nolan,Leonardo DiCaprio,Tom Hardy,Joseph Gordon-Levitt,Action Adventure Sci-Fi Thriller,inception,Christopher Nolan Leonardo DiCaprio Tom Hardy Joseph Gordon-Levitt Action Adventure Sci-Fi Thriller
Peter Jackson,Aidan Turner,Adam Brown,James Nesbitt,Adventure Fantasy,the hobbit: an unexpected journey,Peter Jackson Aidan Turner Adam Brown James Nesbitt Adventure Fantasy
David Fincher,Brad Pitt,Jason Flemyng,Julia Ormond,Drama Fantasy Romance,the curious case of benjamin button,David Fincher Brad Pitt Jason Flemyng Julia Ormond Drama Fantasy Romance
Matthew Vaughn,Jennifer Lawrence,Michael Fassbender,Oliver Platt,Action Adventure Sci-Fi,x-men: first class,Matthew Vaughn Jennifer Lawrence Michael Fassbender Oliver Platt Action Adventure Sci-Fi
Francis Lawrence,Jennifer Lawrence,Philip Seymour Hoffman,Josh Hutcherson,Adventure Sci-Fi,the hunger games: mockingjay - part 2,Francis Lawrence Jennifer Lawrence Philip Seymour Hoffman Josh Hutcherson Adventure Sci-Fi
Jon Turteltaub,Nicolas Cage,Omar Benson Miller,Robert Capron,Action Adventure Family Fantasy,the sorcerer's apprentice,Jon Turteltaub Nicolas Cage Omar Benson Miller Robert Capron Action Adventure Family Fantasy
Wolfgang Petersen,Jimmy Bennett,Mike Vogel,Andre Braugher,Action Adventure Drama Thriller,poseidon,Wolfgang Petersen Jimmy Bennett Mike Vogel Andre Braugher Action Adventure Drama Thriller
James Bobin,Johnny Depp,Alan Rickman,Anne Hathaway,Adventure Family Fantasy,alice through the looking glass,James Bobin Johnny Depp Alan Rickman Anne Hathaway Adventure Family Fantasy
Chris Miller,Justin Timberlake,Eric Idle,Rupert Everett,Adventure Animation Comedy Family Fantasy,shrek the third,Chris Miller Justin Timberlake Eric Idle Rupert Everett Adventure Animation Comedy Family Fantasy
Duncan Jones,Dominic Cooper,Callum Rennie,Ruth Negga,Action Adventure Fantasy,warcraft,Duncan Jones Dominic Cooper Callum Rennie Ruth Negga Action Adventure Fantasy
Alan Taylor,J.K. Simmons,Emilia Clarke,Matt Smith,Action Adventure Sci-Fi,terminator genisys,Alan Taylor J.K. Simmons Emilia Clarke Matt Smith Action Adventure Sci-Fi
Michael Apted,Bruce Spence,Shane Rangi,Laura Brent,Adventure Family Fantasy,the chronicles of narnia: the voyage of the dawn treader,Michael Apted Bruce Spence Shane Rangi Laura Brent Adventure Family Fantasy
Michael Bay,Jennifer Garner,Jaime King,Mako,Action Drama History Romance War,pearl harbor,Michael Bay Jennifer Garner Jaime King Mako Action Drama History Romance War
Michael Bay,Zack Ward,Michael O'Neill,Kevin Dunn,Action Adventure Sci-Fi,transformers,Michael Bay Zack Ward Michael O'Neill Kevin Dunn Action Adventure Sci-Fi
Oliver Stone,Anthony Hopkins,Angelina Jolie Pitt,Brian Blessed,Action Adventure Biography Drama History Romance War,alexander,Oliver Stone Anthony Hopkins Angelina Jolie Pitt Brian Blessed Action Adventure Biography Drama History Romance War
David Yates,Robert Pattinson,Daniel Radcliffe,Fiona Shaw,Adventure Family Fantasy Mystery,harry potter and the order of the phoenix,David Yates Robert Pattinson Daniel Radcliffe Fiona Shaw Adventure Family Fantasy Mystery
Mike Newell,Robert Pattinson,Daniel Radcliffe,Rupert Grint,Adventure Family Fantasy Mystery,harry potter and the goblet of fire,Mike Newell Robert Pattinson Daniel Radcliffe Rupert Grint Adventure Family Fantasy Mystery
Peter Berg,Will Smith,Charlize Theron,Eddie Marsan,Action Drama,hancock,Peter Berg Will Smith Charlize Theron Eddie Marsan Action Drama
Francis Lawrence,Will Smith,Alice Braga,Willow Smith,Drama Horror Sci-Fi,i am legend,Francis Lawrence Will Smith Alice Braga Willow Smith Drama Horror Sci-Fi
Tim Burton,Johnny Depp,Christopher Lee,David Kelly,Adventure Comedy Family Fantasy,charlie and the chocolate factory,Tim Burton Johnny Depp Christopher Lee David Kelly Adventure Comedy Family Fantasy
Brad Bird,Janeane Garofalo,John Ratzenberger,Brian Dennehy,Animation Comedy Family Fantasy,ratatouille,Brad Bird Janeane Garofalo John Ratzenberger Brian Dennehy Animation Comedy Family Fantasy
Christopher Nolan,Christian Bale,Liam Neeson,Morgan Freeman,Action Adventure,batman begins,Christopher Nolan Christian Bale Liam Neeson Morgan Freeman Action Adventure
Eric Darnell,Bernie Mac,Jada Pinkett Smith,Cedric the Entertainer,Action Adventure Animation Comedy Family,madagascar: escape 2 africa,Eric Darnell Bernie Mac Jada Pinkett Smith Cedric the Entertainer Action Adventure Animation Comedy Family
Shawn Levy,Robin Williams,Rami Malek,Steve Coogan,Adventure Comedy Family Fantasy,night at the museum: battle of the smithsonian,Shawn Levy Robin Williams Rami Malek Steve Coogan Adventure Comedy Family Fantasy
Gavin Hood,Hugh Jackman,Ryan Reynolds,Dominic Monaghan,Action Adventure Fantasy Sci-Fi Thriller,x-men origins: wolverine,Gavin Hood Hugh Jackman Ryan Reynolds Dominic Monaghan Action Adventure Fantasy Sci-Fi Thriller
Lana Wachowski,Essie Davis,Collin Chou,Nona Gaye,Action Sci-Fi,the matrix revolutions,Lana Wachowski Essie Davis Collin Chou Nona Gaye Action Sci-Fi
Chris Buck,Josh Gad,Maurice LaMarche,Livvy Stubenrauch,Adventure Animation Comedy Family Fantasy Musical,frozen,Chris Buck Josh Gad Maurice LaMarche Livvy Stubenrauch Adventure Animation Comedy Family Fantasy Musical
Lana Wachowski,Steve Bastoni,Daniel Bernhardt,Helmut Bakaitis,Action Sci-Fi,the matrix reloaded,Lana Wachowski Steve Bastoni Daniel Bernhardt Helmut Bakaitis Action Sci-Fi
Alan Taylor,Chris Hemsworth,Natalie Portman,Anthony Hopkins,Action Adventure Fantasy,thor: the dark world,Alan Taylor Chris Hemsworth Natalie Portman Anthony Hopkins Action Adventure Fantasy
George Miller,Tom Hardy,Charlize Theron,Zoë Kravitz,Action Adventure Sci-Fi Thriller,mad max: fury road,George Miller Tom Hardy Charlize Theron Zoë Kravitz Action Adventure Sci-Fi Thriller
Ron Howard,Tom Hanks,Ayelet Zurer,Armin Mueller-Stahl,Mystery Thriller,angels & demons,Ron Howard Tom Hanks Ayelet Zurer Armin Mueller-Stahl Mystery Thriller
Kenneth Branagh,Chris Hemsworth,Natalie Portman,Anthony Hopkins,Action Adventure Fantasy,thor,Kenneth Branagh Chris Hemsworth Natalie Portman Anthony Hopkins Action Adventure Fantasy
Byron Howard,Chloë Grace Moretz,Diedrich Bader,James Lipton,Adventure Animation Comedy Drama Family,bolt,Byron Howard Chloë Grace Moretz Diedrich Bader James Lipton Adventure Animation Comedy Drama Family
Hoyt Yeatman,Kelli Garner,Piper Mackenzie Harris,Niecy Nash,Action Adventure Animation Comedy Family Fantasy Sci-Fi,g-force,Hoyt Yeatman Kelli Garner Piper Mackenzie Harris Niecy Nash Action Adventure Animation Comedy Family Fantasy Sci-Fi
Jonathan Liebesman,Liam Neeson,Edgar Ramírez,Lily James,Action Adventure Fantasy,wrath of the titans,Jonathan Liebesman Liam Neeson Edgar Ramírez Lily James Action Adventure Fantasy
Tim Burton,Johnny Depp,Chloë Grace Moretz,Christopher Lee,Comedy Fantasy Horror,dark shadows,Tim Burton Johnny Depp Chloë Grace Moretz Christopher Lee Comedy Fantasy Horror
Christopher McQuarrie,Tom Cruise,Jeremy Renner,Sean Harris,Action Adventure Thriller,mission: impossible - rogue nation,Christopher McQuarrie Tom Cruise Jeremy Renner Sean Harris Action Adventure Thriller
Joe Johnston,Anthony Hopkins,Simon Merrells,Art Malik,Drama Fantasy Horror Thriller,the wolfman,Joe Johnston Anthony Hopkins Simon Merrells Art Malik Drama Fantasy Horror Thriller
David Yates,Christoph Waltz,Alexander Skarsgård,Casper Crump,Action Adventure Drama Romance,the legend of tarzan,David Yates Christoph Waltz Alexander Skarsgård Casper Crump Action Adventure Drama Romance
Steve Hickner,Matthew Broderick,Oprah Winfrey,Rip Torn,Adventure Animation Comedy Family,bee movie,Steve Hickner Matthew Broderick Oprah Winfrey Rip Torn Adventure Animation Comedy Family
Jennifer Yuh Nelson,Angelina Jolie Pitt,Gary Oldman,Mike Bell,Action Adventure Animation Comedy Family,kung fu panda 2,Jennifer Yuh Nelson Angelina Jolie Pitt Gary Oldman Mike Bell Action Adventure Animation Comedy Family
M. Night Shyamalan,Seychelle Gabriel,Noah Ringer,Aasif Mandvi,Action Adventure Family Fantasy,the last airbender,M. Night Shyamalan Seychelle Gabriel Noah Ringer Aasif Mandvi Action Adventure Family Fantasy
J.J. Abrams,Philip Seymour Hoffman,Tom Cruise,Eddie Marsan,Action Adventure Thriller,mission: impossible iii,J.J. Abrams Philip Seymour Hoffman Tom Cruise Eddie Marsan Action Adventure Thriller
Roland Emmerich,Channing Tatum,Jake Weber,Matt Craven,Action Drama Thriller,white house down,Roland Emmerich Channing Tatum Jake Weber Matt Craven Action Drama Thriller
Simon Wells,Elisabeth Harnois,Dan Fogler,Tom Everett Scott,Action Adventure Animation Comedy Family Sci-Fi,mars needs moms,Simon Wells Elisabeth Harnois Dan Fogler Tom Everett Scott Action Adventure Animation Comedy Family Sci-Fi
David Bowers,Hugh Jackman,Kate Winslet,David Suchet,Adventure Animation Comedy Family,flushed away,David Bowers Hugh Jackman Kate Winslet David Suchet Adventure Animation Comedy Family
Rob Minkoff,Ty Burrell,Zach Callison,Karan Brar,Adventure Animation Comedy Family Sci-Fi,mr. peabody & sherman,Rob Minkoff Ty Burrell Zach Callison Karan Brar Adventure Animation Comedy Family Sci-Fi
Wolfgang Petersen,Brad Pitt,Orlando Bloom,Julian Glover,Adventure,troy,Wolfgang Petersen Brad Pitt Orlando Bloom Julian Glover Adventure
